title,label,time,host,continue,sort,hot
浪姐4谢娜人气排第一,综艺,2023-05-06,晨星视频,504,1,1011114
为什么香飘飘卖不动了,社会,2023-05-06,新浪热点,87,1,1874809
瞿颖的腿秒了,明星,2023-05-05,绵羊视频,299,5,1090797
大冰,读书,2023-05-05,,413,1,1968462
朱珠好像圈外人,综艺-内地综艺,2023-05-05,重头剧,451,1,1977766
谢娜回应被说好吵,综艺,2023-05-05,前线时报,212,2,1151217
男朋友28了还是离不开安抚巾,搞笑,2023-05-05,卿陌学姐,640,2,1581201
蔡徐坤被判支付前东家300万违约金,财经,2023-05-05,财经网,375,1,2158272
法医回应情侣巴厘岛酒店遇害,社会,2023-05-05,澎湃新闻,422,2,1313851
6岁女童检查异常医生强制报告,社会,2023-05-05,中国新闻周刊,446,1,1902054
宋雨琦把关晓彤挠下去了,综艺,2023-05-05,剧星文娱,137,6,1414527
同事辟谣挖呀挖黄老师辞职,社会,2023-05-05,九派新闻,125,8,1016637
全国都在咽喉炎吗,搞笑,2023-05-05,我与老公的日常,486,1,2514897
五月天官宣鸟巢连开六场,音乐-华语音乐,2023-05-05,新浪音乐,389,4,1234411
易烊千玺这么热还穿内搭,明星-内地,2023-05-05,影视综艺分享,100,5,1206512
大熊猫圆梦将回国,社会,2023-05-05,中国侨网,125,7,1069531
祝融号数据显示现代火星存在液态水,社会,2023-05-05,央视新闻,206,3,1695598
翻车后大家不约而同的这个动作太暖心,社会,2023-05-05,新华网,159,2,1530386
朱珠好美啊,综艺-内地综艺,2023-05-05,非著名安利专家,238,4,1582859
黄子韬给鹿晗打电话,综艺,2023-05-05,新浪综艺,457,2,1434349
谢娜综艺代表作没写快乐大本营,综艺-内地综艺,2023-05-05,宇宙冲浪独角兽,269,1,1725716
乘风4二公淘汰名单,综艺,2023-05-05,鲜娱视界,353,2,1406266
四岁男童颅脑损伤监控显示曾被老师扔摔,社会,2023-05-05,钱江晚报,480,1,1215068
今天是马克思诞辰205周年,社会,2023-05-05,新华网,289,3,1860763
好友称巴厘岛命案死者正环游世界,社会,2023-05-05,头条新闻,1041,1,1581200
身亡情侣家属已赶赴巴厘岛,社会,2023-05-05,头条新闻,484,4,1159295
秋瓷炫初舞台唱无法原谅,综艺,2023-05-05,内娱教父,230,6,1259558
蜜雪冰城回应顾客在饮品中喝到大蟑螂,社会,2023-05-05,沸点视频,398,1,1745887
刘亚仁男友被立案调查,明星-日韩,2023-05-05,清流娱乐网,300,2,1337475
高铁上的一声姐姐花了我35元,搞笑,2023-05-05,赵乐呵,774,2,1045670
藏在这场人从众里的世间温柔,社会,2023-05-05,人民日报,778,3,1367530
姜思达下架史航事件播客,明星,2023-05-05,娱乐小浪花er,233,4,1036982
巴厘岛身亡两中国公民身份确认,社会,2023-05-05,中国新闻周刊,578,1,1099713
扒光男童上衣女幼师被拘留8天,社会,2023-05-05,都市快报,65,1,1356747
情侣产子后分手老人帮带娃8年,社会,2023-05-04,都市时报,615,1,1413600
全员加速中,综艺,2023-05-04,湖南卫视全员加速中,515,1,1456644
小说里刀削般的面容找到了,搞笑,2023-05-04,网恋必死,379,1,1303815
友人称巴厘岛身亡两人已恋爱多年,社会,2023-05-04,红星新闻,204,1,2019609
许嵩台上唱歌冯禧台下笑,明星-内地,2023-05-04,纯纯视频,304,2,1061241
巴厘岛命案,社会,2023-05-04,,293,1,1458461
上海的垃圾桶到底在哪里,搞笑,2023-05-04,赵乐呵,448,1,1098487
宋茜人缘,电视剧,2023-05-04,追艺视频,113,4,1153866
薛之谦又是站票回去的,明星-内地,2023-05-04,剧综指南,187,1,1747633
领事馆确认两中国公民在巴厘岛身亡,社会,2023-05-04,中国新闻周刊,493,1,1782400
常年不吃碳水的人怎么样了,搞笑,2023-05-04,科普抽屉,1253,1,1928421
90后姑娘帮上万名村民喝上安全的水,社会,2023-05-04,央视新闻,179,2,1024971
当我和妈妈说离婚了,情感,2023-05-04,张允晨,615,1,2305476
对青春最好的致敬是成为更好的自己,社会,2023-05-04,央视新闻,239,3,1130818
家长带4名孩子摸螺蛳3人不幸溺亡,社会,2023-05-04,凤凰网,757,2,1458600
史航事件当事人再发声,社会,2023-05-04,四川电视台新闻现场,405,4,1261423
旅行七天和老公吵了五次,搞笑,2023-05-04,馋嘴猫,698,2,1380554
周杰伦申请限消痘博士,财经,2023-05-04,中新经纬,356,1,1355630
五四放假通知,社会,2023-05-04,北京青年报,581,1,3557425
2中国游客在印尼巴厘岛身亡,社会,2023-05-04,九派新闻,540,4,1634394
高铁上最好不要和邻座套近乎,搞笑,2023-05-04,摸鱼艺术大赏,959,1,1093836
激扬青春,社会,2023-05-04,人民日报,311,3,1727007
四川宜宾地震,社会,2023-05-04,央视新闻,126,4,1281094
五四青年节,社会,2023-05-04,共青团中央,249,2,1458710
这个五一274000000人次出游,社会,2023-05-04,央视新闻,659,3,1483862
景区2天内捡了23个娃,社会,2023-05-03,荔枝新闻,859,2,1241744
陈晓觉得陈妍希最适合拍戏,电视剧-国产剧,2023-05-03,新爱豆,567,2,1153201
韩国大学生吃掉价值12万美元香蕉展品,其他,2023-05-03,新浪热点,985,1,2517149
五三惨案,社会,2023-05-03,济南时报,826,1,2738693
史航聊天记录,明星,2023-05-03,新浪娱乐,743,4,1404850
48岁冻龄妈妈谈被家暴经历,综艺,2023-05-03,北青网娱乐,580,5,1054849
EXO,明星-日韩,2023-05-03,,366,4,1992587
端午节也要调休,情感,2023-05-03,伯文,612,1,3301989
高铁上碰到了一对情侣想换座,搞笑,2023-05-03,赵乐呵,407,4,1590634
相识24年的闺蜜突然去世了,搞笑,2023-05-03,牵年,283,1,2025602
长月烬明就演到这吧,电视剧,2023-05-03,MusicFM993,238,2,1245696
热心大哥高铁上怒斥熊孩子家长获喝彩,社会,2023-05-03,沸点视频,363,2,1996752
无人机视角看假期里的美丽中国,社会,2023-05-03,新华社,251,3,2032366
山东男孩五一路边3天拉来1500元客单,社会,2023-05-03,西部决策,349,5,1203974
劳动是奋斗追梦的五光十色,社会,2023-05-03,新华网,196,3,1262651
一家三口五一出游被困悬崖边,社会,2023-05-03,西部决策,507,2,1055033
湖人1比0勇士,体育,2023-05-03,NBA,184,2,1471725
史航称不存在性骚扰,社会,2023-05-03,头条新闻,830,1,2947241
湖人对战勇士,体育,2023-05-03,NBA,305,5,1280129
深地一号超深井放喷测试点火现场,社会,2023-05-03,央视新闻,809,3,1429770
云南保山5.2级地震,社会,2023-05-03,钱江视频,466,2,1316917
男子人流中故意蹭女孩身体,社会,2023-05-03,新浪新闻,61,2,1145058
要不要为了编制回小县城,情感,2023-05-02,苏汶涛,463,1,1907610
年收入二十万是怎样的水平,搞笑,2023-05-02,美食Zhang,890,2,1322560
暴雨大暴雨要来了,社会,2023-05-02,湖北日报,955,2,1500601
女子淄博吃烧烤排不上队被热情投喂,社会,2023-05-02,西部决策,517,1,2021432
至少已有12名发声者指控史航性骚扰,社会,2023-05-02,新浪新闻,244,1,1320754
杨紫琼王嘉尔牵手,明星-内地,2023-05-02,桔星文艺,472,2,1842385
新娘互换手捧花发现是高中同学,社会,2023-05-02,大象新闻,185,2,1395160
假期依然坚守岗位的劳动者,社会,2023-05-02,人民日报,178,3,1582255
cp29,动漫,2023-05-02,COMICUP囧猫娘,441,2,1082791
游客给淄博一线工作人员送鲜花,社会,2023-05-02,西部决策,156,4,1315795
淄博主打的就是一个走心,社会,2023-05-02,新华网,125,6,1277931
五名指控史航受害者发布联合声明,明星-内地,2023-05-02,澎湃新闻,125,1,1677195
白敬亭宋轶主打一个陪伴,明星-内地,2023-05-02,饭圈阿姨,675,4,1389467
云襄传313条人命案,电视剧,2023-05-02,十三姨追剧,482,4,1526904
73岁大爷头婚娶69岁大妈,社会,2023-05-02,头条新闻,1134,2,1032049
中国色彩闪耀太空,社会,2023-05-02,央视网,435,3,2007715
VOGUE官方把蔡徐坤认成王嘉尔,明星,2023-05-02,职业观众,196,2,1731070
秦昊说观众牛逼,明星-内地,2023-05-02,纯纯视频,343,5,1146020
Jennie山茶花白裙,明星-日韩,2023-05-02,哎一股清流,105,5,1004015
光荣属于劳动者,社会,2023-05-02,人民日报,703,3,1397145
月收入一万真的简单吗,搞笑,2023-05-02,办公室嘴替,576,1,1454327
这是在攻打重庆吗,搞笑,2023-05-01,别是个沙雕吧,636,2,1169732
烧烤店老板为劝退游客自刷17个差评,社会,2023-05-01,新浪新闻,725,2,1404611
半夜醒了不要拿手机看时间,社会,2023-05-01,央视网,962,1,1389105
提名你一听到主演名字就不会打开的剧,明星,2023-05-01,新欣文娱,407,5,1124407
拉萨客栈杀人案嫌犯已被抓捕,社会,2023-05-01,水母网,290,1,2289801
陈晓毛晓彤十年前vs十年后,电视剧,2023-05-01,职业观众,198,1,1951901
女演员晒裸照反击黑客勒索,明星,2023-05-01,新浪娱乐,648,1,3822700
朋友圈发什么最让人反感,情感,2023-05-01,旧巷情话,274,1,2633997
宋祖儿差点取关毛晓彤,电视剧,2023-05-01,追艺视频,125,2,1831194
跳动的数字看加速前进的中国,社会,2023-05-01,央视新闻,260,3,1907272
史上最挤五一档却没带火电影院,社会,2023-05-01,头条新闻,603,2,1377102
洪欣张丹峰离婚,明星-港台,2023-05-01,新浪娱乐,502,1,3450988
5岁娃隔马路向警察爸爸敬礼,社会,2023-05-01,新华社,139,5,1206403
每一个奋斗的你都了不起,社会,2023-05-01,新华社,315,3,1639465
长大后童年报复性补偿行为,搞笑,2023-05-01,美食Zhang,297,2,1143124
卫星视角下的花开中国太美了,社会,2023-05-01,人民网,753,3,1331392
王源爸妈不在的演唱会状态,音乐-华语音乐,2023-05-01,小卡看剧追综,699,1,1249056
女子为亡夫销户痛哭民警为其留户籍页,社会,2023-05-01,西部决策,606,1,1311364
人人人人人你人人人人人,社会,2023-04-30,新华社,1431,1,1111624
淄博一快递员因限流不让进下跪大哭,社会,2023-04-30,九派新闻,323,1,1196377
淄博一酒店涨价1.5倍被立案调查,社会,2023-04-30,沸点视频,547,1,2562901
和豪门大佬网恋后我红了,读书,2023-04-30,星文图书,253,1,1495248
周杰伦问已经是第一名的人要怎么变,明星,2023-04-30,娱超人,467,1,1549669
婚礼前一天被通知不需要伴娘,搞笑,2023-04-30,牵年,213,1,2198762
五一档三部电影票房破亿了,电影-华语电影,2023-04-30,奇异文娱,671,2,1359303
两位揭发史航性骚扰女孩发声,社会,2023-04-30,澎湃新闻,290,1,1771423
3名小学生发现笑气果断报警获奖励,社会,2023-04-30,钱江视频,277,2,1446601
海底捞一门店睡满人导致无法用餐,财经,2023-04-30,老板联播,1130,1,1506761
黄山景区回应游客在厕所过夜,社会,2023-04-30,九派新闻,428,4,1092910
这是卫星视角下的美丽中国,社会,2023-04-30,新华社,927,3,1298909
今年的五一疯了吗,情感,2023-04-30,苏汶涛,877,1,1081190
粉丝问王源爸爸怎么抢到这么好的位置,明星-内地,2023-04-30,影视综艺分享,108,2,1306764
客栈回应住客床底发现死尸,社会,2023-04-30,头条新闻,159,1,1400880
抢不到票但车上好多空座位,情感,2023-04-30,苏汶涛,208,1,1953660
王源染了绿发,明星,2023-04-30,看点热剧,524,4,1086870
这居然是林小宅,明星,2023-04-29,听月娱乐,820,2,1331822
五一预计240000000人次出游,社会,2023-04-29,央视新闻,896,1,2883436
纽约裸体晚宴参与者全身赤裸食用素食,社会,2023-04-29,观察者网,67,1,1905515
谷爱凌发的图vsAngelababy发的图,明星-内地,2023-04-29,追星狗,420,1,1656536
丫丫有堆成小山的竹子,社会,2023-04-29,新华网,285,2,1706603
娜扎复刻自己的名场面,综艺,2023-04-29,我东家的娱乐,21,4,1005390
周深唱哭张颂文,电影,2023-04-29,1905电影网官博,60,5,1207569
张颂文看到已故经纪人照片泪目,明星,2023-04-29,鲜娱视界,86,2,1663591
微信回复领导两年前的消息,搞笑,2023-04-29,领导我是小明,1344,1,1182568
秋瓷炫你要是被淘汰就点个痣再回来,明星-内地,2023-04-29,饭圈阿姨,433,1,1368390
全资进组,电视剧,2023-04-29,全资进组官微,408,2,1077885
五一假期卫星带你云旅行,社会,2023-04-29,新华网,215,3,1359949
徐娇成绩全A,明星-内地,2023-04-29,会火剧综,590,2,1476713
罗云熙的鞋跟,明星,2023-04-29,剧综班主任,303,4,1170975
林智妍杂志疑似抄袭倪妮造型,明星,2023-04-29,看点热剧,550,2,1056940
国内旅游订单创5年来最高,社会,2023-04-29,人民日报,391,3,1880299
青年艺术家孙博离世,明星,2023-04-29,北青娱见,322,1,1561392
著名相声演员李建华去世,明星,2023-04-29,北青娱见,707,1,1159233
传统村落集中连片保护利用示范名单,社会,2023-04-29,新华社,658,3,1281332
谢娜说你宁愿相信一张纸都不相信我,综艺,2023-04-29,新浪综艺,650,1,1171868
向往的生活最后一季,综艺-内地综艺,2023-04-29,综艺影视全能君,644,1,1255542
对方撤回了一个宝宝,搞笑,2023-04-28,搞笑赖赖,474,1,2034696
孙俪曾被质疑甲亢去医院检查,明星,2023-04-28,班尼弟弟,391,2,1217030
江歌妈妈看望章莹颖父母,社会,2023-04-28,西部决策,470,1,1968723
丫丫回家后吃饭吃得好香,社会,2023-04-28,人民日报,1435,1,3211644
丫丫的眼睛亮晶晶,社会,2023-04-28,新华网,368,5,2046314
给淄博烧烤泼一盆冷水,社会,2023-04-28,新华社,1010,2,2056904
谁给易烊千玺化的妆,明星-内地,2023-04-28,半勺奶霜,447,2,1076799
陈都灵看不下去了,明星-内地,2023-04-28,饭圈阿姨,329,4,1053189
北京已严重拥堵,社会,2023-04-28,贝壳财经,259,1,1991472
汤唯再获百想影后,明星,2023-04-28,最甜的瓜与花,288,1,2052297
李亚鹏称为自己的错误买单,财经,2023-04-28,老板联播,422,4,1202078
数字经济事关国家发展大局,时事,2023-04-28,央广网,287,3,2406708
90后书记员凭朋友圈成功出圈,法律,2023-04-28,法治日报,257,1,2463065
李亚鹏被强制执行4000万,财经,2023-04-28,中新经纬,220,6,1033893
宋慧乔百想视后,电视剧,2023-04-28,新浪大文娱,41,1,2580957
拼多多被曝临时确定五一放假三天,互联网,2023-04-28,新浪科技,618,1,3075287
谢娜说生完孩子长高了,综艺-内地综艺,2023-04-28,番茄娱乐,410,2,1452690
朋友圈已经没有了生活的痕迹,公益,2023-04-28,朋友圈那点事,1098,1,2696174
因业绩好被扣9000多,生活记录,2023-04-28,杨舒惠,565,2,1548769
谷爱凌Angelababy合影,明星,2023-04-28,八卦热点聚焦,402,4,1415776
裸眼3D看中国空间站,社会,2023-04-28,新华社,367,3,1744477
丫丫一到机场就收到了竹子,社会,2023-04-28,央视新闻,877,1,1326033
为什么熟人性侵高发,社会,2023-04-28,新京报文娱,867,4,1068898
丫丫到家后近照,社会,2023-04-28,央视新闻,863,1,1894996
五一出行实用贴士,社会,2023-04-28,央视新闻,692,3,2244804
鹿晗肖战坐一起,明星,2023-04-28,辰星文娱,64,1,2812706
乐乐死因报告的情况说明,社会,2023-04-28,中国蓝新闻,593,1,1211200
去世两年后他突然出现在篮球场上,社会,2023-04-27,新华网,926,1,2263972
没想到整个部门全都离职了,情感,2023-04-27,欢乐摸鱼指南,460,2,2322349
丫丫回国后安排,社会,2023-04-27,央视新闻,269,4,1736007
长沙游客不满8根炸串115元被骂穷,社会,2023-04-27,新浪新闻,406,4,2026067
肖战舒淇合照,明星,2023-04-27,迷妹速报,55,1,2852679
GUCCI红毯,时尚,2023-04-27,FashionWealth,273,4,2488331
丫丫专机已降落上海,社会,2023-04-27,央视新闻,393,1,9487544
段奕宏的脸,明星,2023-04-27,看点热剧,131,8,1059159
流动的中国生机勃勃,社会,2023-04-27,央视新闻,308,3,4293837
梅姨案2名人贩子被执行死刑,社会,2023-04-27,头条新闻,352,1,2408910
男子悬空救女孩腿抽筋民警接力跟上,社会,2023-04-27,农民频道,139,2,4938529
陈都灵邓为花朵吻,明星-内地,2023-04-27,阿瓜的娱乐圈冲浪日记,446,2,1312425
周也听到谢谢阿瑟的反应,明星,2023-04-27,探长文娱,362,3,1228354
女子称肚痛就医检查遭医生猥亵,社会,2023-04-27,九派新闻,1073,1,1699080
曾经很火却已消失了的品牌,情感,2023-04-27,旧巷情言,1049,1,2360850
CL被曝耍大牌,明星,2023-04-27,追剧八爪娱,264,2,1285443
38岁985硕士失业被迫送外卖,综艺,2023-04-27,凤凰网,257,1,3134112
曝王雷改戏黄轩辞演上甘岭,明星-内地,2023-04-27,看点热剧,240,1,1889013
丫丫启程回国,社会,2023-04-27,新华社,1015,1,2093155
巴特勒太硬了,体育,2023-04-27,新浪NBA,220,1,3000675
NBA裁判,体育,2023-04-27,微博篮球,185,5,1111314
第六届数字中国建设峰会,其他,2023-04-27,数字中国建设峰会,613,3,1752648
女子淄博买切糕2种口味称重仅6元,社会,2023-04-26,星视频,589,1,2320183
何炅黄磊好像两个假笑空巢老人,综艺,2023-04-26,国产剧研究中心,443,1,1760286
女生厕所遇代孕广告用贴纸遮盖,社会,2023-04-26,山海视频,457,1,1849281
专家称五一调休是动了脑筋的做法,财经,2023-04-26,中新经纬,377,1,2997342
刘畊宏了一年的变化,情感,2023-04-26,伯文,367,1,1467198
gidle将在长沙举办签售会,明星-港台,2023-04-26,会火,79,4,1121034
压力给到张子枫,明星-内地,2023-04-26,饭圈阿姨,188,2,1733795
娜扎身材,明星-内地,2023-04-26,新浪电视,209,4,1000878
习近平同泽连斯基通电话,时事,2023-04-26,央视新闻,147,1,1547375
淄博喊话推荐其他山东城市,社会,2023-04-26,人民日报,462,2,2038057
这些文化遗存现今的模样,社会,2023-04-26,光明日报,283,3,1744921
现实版湘北队超32分赢了山王队,社会,2023-04-26,大米Video,99,7,1078817
丫丫将回国,社会,2023-04-26,新华社,323,2,1265454
现偶收视率前十里有五部是张翰的,电视剧,2023-04-26,蛋黄给你吃,405,1,1819695
不建议跟一累就黑脸的人出去玩,搞笑,2023-04-26,我变成葡萄了,545,1,2549097
海南一12岁小学生骑车被撞身亡,社会,2023-04-26,猛犸新闻,313,4,1160119
梅姨在广州落网消息不实,社会,2023-04-26,南方都市报,361,2,1069566
谢娜再回应助理打手机事件,明星-内地,2023-04-26,搜狐娱乐,503,1,1791898
行走百县话振兴,社会,2023-04-26,新华社,955,3,1773927
99年女子疑过度劳累宿舍猝死,社会,2023-04-26,头条新闻,486,1,2696801
面试1小时发现走错反获2家公司offer,社会,2023-04-26,搜狐千里眼,780,1,1336062
看着不体面但很赚钱的工作,情感,2023-04-26,旧巷情言,769,2,1411781
孙卓被拐案代理律师称梅姨已被抓,社会,2023-04-26,凤凰网,142,2,1535743
张雨绮微信名叫高启强,综艺,2023-04-25,浪里看综艺,418,2,1738708
教师请病假25年退休前编制消失,社会,2023-04-25,九派新闻,469,1,4000115
四月底HR才开始急了,情感,2023-04-25,张春天yE,293,5,1037226
这竟然是彭昱畅,明星-内地,2023-04-25,酷然视频,186,1,1749466
陈都灵方否认发艳压通稿,明星,2023-04-25,中新文娱,554,1,1814971
因为聚餐吃太多被辞退了,搞笑,2023-04-25,国产剧班主任,454,2,1341391
爸爸吃饼卡喉15岁女儿1分钟救回,社会,2023-04-25,农民频道,297,2,2230657
浙D1026S你被拍下来了,社会,2023-04-25,新华社,342,5,1445240
萌娃小心翼翼向武警敬礼收到惊喜回应,社会,2023-04-25,央视新闻,81,7,1212681
毛戈平为赵露思化的妆,明星,2023-04-25,新欣文娱,155,4,1445180
被全网黑但逆风翻盘的明星,明星,2023-04-25,纯纯视频,482,1,2768826
曾经的朋友成为了明星,明星,2023-04-25,蜀黍的瓜田,404,2,1561365
这个答案写满中国航天的自信和底气,社会,2023-04-25,央视新闻,310,3,1651960
内娱选秀团全部解散,明星,2023-04-25,班尼弟弟,454,1,2214299
婴儿高铁上哭闹女子和宝妈对骂,社会,2023-04-25,头条新闻,512,1,2670181
为什么读了研也找不到工作,教育,2023-04-25,_恶魔奶爸_,531,1,2291862
易烊千玺新专辑刘艳芬,音乐-华语音乐,2023-04-25,新浪音乐,115,2,1566420
五一三倍工资你会选择加班吗,搞笑,2023-04-25,梗王爷,180,3,1395454
易烊千玺雕像被涂花,明星,2023-04-25,饭里追剧,275,3,1189401
安徽一算命网红3年非法盈利200多万,财经-其他,2023-04-25,老板联播,804,1,1593704
广交会展览规模再创历史新高,社会,2023-04-25,央视新闻,733,3,1829416
李佳琦刘畊宏等5位主播被点名,明星,2023-04-24,都市快报,660,1,3012483
沈腾说马丽和乔杉搭感觉没有那么顺,电影,2023-04-24,新浪电影,148,2,1105643
上午离职下午收到offer,搞笑,2023-04-24,打工人发言,456,1,3001429
东南大学一领导被曝工作群发色情照,社会,2023-04-24,九派新闻,418,2,2593529
我国实行周末双休制还不足30年,社会,2023-04-24,西部决策,389,1,2255444
林心如和女儿视频通话,综艺,2023-04-24,芒果捞小萌主,218,2,1113728
月收入多少才算是普通人,情感,2023-04-24,沈绪淮,130,1,1323736
给女儿准备三万本书当书房,读书,2023-04-24,喜脉洗脉,205,1,1611174
没认出来陈乔恩,明星,2023-04-24,探长文娱,473,2,1303825
我国法定假日从7天增至11天,社会,2023-04-24,新浪新闻,195,1,3613978
经期千万别喝豆浆,搞笑,2023-04-24,夏木帆,238,1,1755571
今天我们为何还要读书,社会,2023-04-24,人民日报,360,3,2594407
上海一财务把公司偷得只剩20块,社会,2023-04-24,新浪热点,409,2,1566406
浙江小学生看到罂粟报警,社会,2023-04-24,浙样红TV,173,2,1982597
女生花4天为新婚姐姐绘制百喜图,社会,2023-04-24,山海视频,206,2,2595329
里面躺着英烈外面坐着英雄,社会,2023-04-24,新华网,134,5,1362926
杨颖瘦的原因,明星,2023-04-24,探长文娱,209,2,1496546
B站千万粉丝UP主回应停更传言,社会,2023-04-24,九派新闻,424,1,2799013
杜海涛对沈梦辰屏蔽朋友圈,综艺,2023-04-24,晨报文艺,506,1,3127613
相约八点见,社会,2023-04-24,人民网,909,3,1770097
严禁劣迹艺人随意变相复出捞金,明星,2023-04-24,法治日报,802,1,1690103
Lisa下楼梯,明星-日韩,2023-04-24,榜小花,283,1,1387410
五一民宿现涨价毁约潮,社会,2023-04-24,浙江日报,401,1,1592755
疑戴3万元耳钉女副局长露面,社会,2023-04-24,新浪热点,152,4,1528567
陈都灵邓为高光戏份被删,电视剧,2023-04-24,娱乐News,811,4,1082087
淄博鸭货小哥被女游客摸肌肉,社会,2023-04-24,新浪新闻,189,1,1150763
中介贿赂张靓颖经纪人中标被罚210万,明星-内地,2023-04-24,搜狐娱乐,706,1,1236792
明星最容易翻车的人设,明星-内地,2023-04-23,酷然视频,154,4,1232602
我说谢娜助理怎么那么眼熟,明星,2023-04-23,圈内少年,290,1,2172686
二次感染比第一次更难受吗,社会,2023-04-23,头条新闻,567,1,2002644
王楚钦卫冕男单冠军,体育,2023-04-23,咪咕体育,67,4,1350920
爸爸花费1年为儿子做手工婚床,社会,2023-04-23,大米Video,270,2,1561977
罗云熙直播说不能再吃了胖死了,明星,2023-04-23,追星狗,381,1,1162977
Jennie衣服好辣,明星,2023-04-23,热剧匣子,451,1,1729660
爸爸靠茶具谈崩五个客户,搞笑,2023-04-23,文科班校花酱,402,1,1471413
淄博小饼遭疯抢老板暴瘦20斤,社会,2023-04-23,看看新闻KNEWS,253,2,1223695
女子1月内收5笔工资直呼看不懂,社会,2023-04-23,荔枝新闻,483,1,1456936
中奖一千万要不要告诉父母,搞笑,2023-04-23,国产剧班主任,584,1,3013940
于正说赵丽颖85花演技第一名,明星-内地,2023-04-23,新浪大文娱,461,1,1998923
27岁女儿被妈妈教训女孩不用买房,社会,2023-04-23,新浪新闻,452,4,1789529
原来结婚证里还有温馨小提示,社会,2023-04-23,打鱼晒网,447,1,2257503
女大学生在寝室发现巨拟叶螽,社会,2023-04-23,长沙政法频道,473,1,1698408
谢娜工作室道歉,明星,2023-04-23,娱乐小浪花er,364,1,3033141
珍爱地球中国在行动,社会,2023-04-23,新华社,800,3,1871674
宋茜长发,游戏,2023-04-23,游戏书也酱,693,1,1549003
张杰谢娜助理打手机,明星,2023-04-23,娱乐小浪花er,496,1,1036725
PGONE复出不到24小时被封,明星-内地,2023-04-23,澎湃新闻,413,1,2018080
李晨需要道歉吗,综艺,2023-04-22,追剧综的李二狗,315,4,1065412
长月烬明怎么了,电视剧,2023-04-22,新欣文娱,393,1,1769204
月收入过万是什么水平,社会,2023-04-22,新浪热点,287,1,1896484
刘宇宁把家人说成家人们,电视剧,2023-04-22,听月娱乐,257,2,1744669
老人乘地铁用颤抖的手批改资料,社会,2023-04-22,西部决策,251,2,1661950
台湾地震,社会,2023-04-22,,419,1,1973096
2023中国网络媒体论坛,社会,2023-04-22,人民日报,511,3,1404747
公司五一放三天同事离职了,搞笑,2023-04-22,小猫粮语录,597,2,1230098
宝马mini称两名女生离职消息不实,财经,2023-04-22,老板联播,908,2,1112046
胡先煦回应发腮,明星,2023-04-22,新浪大文娱,758,1,1515640
县在出发,社会,2023-04-22,央视新闻,731,3,1664465
祖孙3人遭杀害事发前凶手曾买寿衣,社会,2023-04-22,头条新闻,129,2,1228505
新加坡一39岁已婚男子猥亵9岁女童,社会,2023-04-22,梨视频,160,1,1039658
失业女生摆摊一天卖5块崩溃痛哭,社会,2023-04-22,AB视频,173,1,1324164
宝马mini两名发冰淇淋女生已离职,社会,2023-04-21,中新经纬,355,6,1588456
原来考个本科真的很难,校园,2023-04-21,大学生名场面,574,1,3309108
赵小棠红毯摔倒,电影-华语电影,2023-04-21,新浪大文娱,330,1,2238798
老番茄求婚,游戏,2023-04-21,游戏势力榜,163,6,1053167
魏晨状态,明星-内地,2023-04-21,圈大哥,234,1,1282869
车银优眼睛哭肿了,明星,2023-04-21,蜀黍的瓜田,398,2,1514422
安以轩老公被判监禁14年,社会,2023-04-21,红星新闻,532,1,2940090
一起回顾中国载人航天高光时刻,社会,2023-04-21,新华网,246,3,2241760
宝马mini称老外是同事,社会,2023-04-21,贝壳财经,719,1,3853315
宝宝打针被医生哄到哭不出来,社会,2023-04-21,人民视频,197,2,2717813
宝马蒸发市值可买约5亿个冰淇淋,社会,2023-04-21,新浪新闻,496,5,1618088
