绝大部分人感染HPV后会自愈,社会,2024-04-13,央视网,483,1,1115415
金秀贤金智媛不再合体,电视剧-韩剧,2024-04-13,看韩影,574,1,1341639
猫一杯旗下品牌发货售后正常,社会,2024-04-13,梨视频,149,2,1045335
Thurman猫一杯视频号被封,社会,2024-04-13,新浪新闻,304,1,2429285
纪凌尘祝阚清子幸福,综艺-内地综艺,2024-04-13,娱圈小美,123,4,1038284
炮制秦朗丢作业丢掉了什么,社会,2024-04-13,人民日报,653,3,1325247
秦皇岛一船只侧翻已致12死6失联,社会,2024-04-13,央视新闻,67,1,1024426
钟美美母亲曾被父亲打骨折,明星-内地,2024-04-13,新浪明星,137,2,1159665
赵丽颖说谢谢狗哥,电视剧,2024-04-13,吸睛时尚,314,1,1313985
留意侧躺玩手机后的眼睛变化,社会,2024-04-13,健康时报,335,2,1281710
春日限定励志文案,社会,2024-04-13,人民日报,57,3,1178091
猫一杯2小时掉10万粉,社会,2024-04-13,西部决策,506,1,1997038
在高原感受别样的春日浪漫,社会,2024-04-13,新华社,60,3,1336218
成毅晒面摊,明星,2024-04-13,反剧荒联盟,283,2,1020545
首饰金价一夜大降10元每克,社会,2024-04-13,梨视频,493,2,1127888
向佐一提郭碧婷就哭,明星,2024-04-13,卦圈少年,440,2,1509004
杨立新遇害前承认婚内出轨怀孕,社会,2024-04-13,头条新闻,626,1,1865434
去医院检查千万别穿成这样,健康,2024-04-13,西部决策,443,1,1693115
伊以冲突,军事,2024-04-13,央广军事,491,1,1880553
马嘉祺有个双胞胎哥哥,综艺,2024-04-13,娱圈甜甜圈,310,1,1583397
女生义乌10元买项链多年后未变色,社会,2024-04-13,白鹿视频,368,1,1321759
不愧是最美的人间四月天,社会,2024-04-13,央视新闻,208,3,1446517
秦朗丢寒假作业系摆拍博主被处罚,社会,2024-04-13,央视新闻,657,1,1090688
乘风2024官宣,综艺,2024-04-12,乘风2024官方微博,394,1,1784117
网红猫一杯道歉,社会,2024-04-12,梨视频,296,1,5601586
鹿晗黄子韬再合作,音乐,2024-04-12,捕娱桃浦丸,453,2,1109792
秦朗丢寒假作业系摆拍博主被处罚,社会,2024-04-12,央视新闻,298,1,3053609
周大福足金戒指不到2个月出现褪色,财经,2024-04-12,科学探索,515,1,1360597
朴宝蓝喝酒后死亡,明星-日韩,2024-04-12,搜狐韩娱,713,1,2132893
诗经里的绝美中国色,社会,2024-04-12,新华网,289,3,1871531
留守女童困在软色情短视频里,社会,2024-04-12,新浪热点,70,1,1319082
死亡野生大熊猫为成年雌性,社会,2024-04-12,央视新闻,265,1,1362864
欺负同学被集体劝退的孩子已在家上网课,社会,2024-04-12,央广网,254,2,1076334
杜海涛当沈梦辰的专属模特,明星-内地,2024-04-12,追新剧视频,133,2,1161064
溺亡大熊猫表面无明显人为伤,社会,2024-04-12,新浪新闻,203,1,1370539
中国卫星又给地球月球拍了张合影,社会,2024-04-12,央视新闻,99,3,1532224
五一其实只放1天,社会,2024-04-12,新浪热点,383,2,1216041
官方回应雅安一野生大熊猫溺亡,社会,2024-04-12,新浪新闻,174,1,1487997
中国航天的12个第一次,社会,2024-04-12,人民日报,238,3,1528157
拜登承诺将用核武器保护日本,军事,2024-04-12,新浪军事,345,4,1152347
人老了为什么身上会有味,社会,2024-04-12,健康时报,340,4,1169355
杨紫裤子不合身,明星,2024-04-12,善娱视频,65,1,1006762
工藤新一不能考公了,动漫-日本动漫,2024-04-12,影视扒爷,415,1,2631155
被轿车撞倒碾压女子已死亡,社会,2024-04-12,新浪新闻,228,1,1796700
歌手朴宝蓝去世,明星,2024-04-12,文大绅士,389,1,2877572
警方通报女子赤身在大学男寝打砸,社会,2024-04-12,青流视频,286,4,1416031
教资成绩发布,社会,2024-04-12,央视新闻,138,1,2472857
苹果市值一夜暴涨8113亿,财经,2024-04-12,梨视频,212,5,1012912
五一调休放5天,社会,2024-04-12,新浪新闻,215,2,1359555
蓝盈莹也做了甘露寺美甲,时尚,2024-04-11,人间幻灯片,319,1,1291495
换儿子血的亿万富翁展示3年抗衰成果,社会,2024-04-11,红星新闻,263,1,1645046
雷军问网友是否支持车上有原装手机支架,财经,2024-04-11,梨视频,228,1,1165703
微信打电话和直接打电话的区别,搞笑,2024-04-11,被牛撞了个满怀,267,2,1108752
赵丽颖王伊瑶友情,电视剧,2024-04-11,正牌娱乐,220,1,1114108
林更新说与赵丽颖搭档是荣幸,明星-内地,2024-04-11,今日星刊,161,1,1450313
越南女首富张美兰被判处死刑,时事,2024-04-11,凤凰网,353,1,1762158
春天的气息藏在花海里,社会,2024-04-11,央视网,199,3,1143213
三月三是什么节,社会,2024-04-11,央视新闻,402,3,1306717
一起打卡春天里的中国,社会,2024-04-11,新华网,60,3,1000704
金星复婚,明星-内地,2024-04-11,新浪娱乐,383,1,5049864
赵丽颖林更新摸头抱,综艺-内地综艺,2024-04-11,新浪综艺,331,1,1310134
刷牙不刷舌头约等于白刷,情感,2024-04-11,楼兰情感,374,1,1789513
韩国国务总理辞职,社会,2024-04-11,总台环球资讯,383,1,1409853
明星客串几分钟却被当主角宣传合适吗,社会,2024-04-11,凤凰网视频,297,2,1297615
走进黄帝故里寻根华夏文明,社会,2024-04-11,人民日报,244,3,1375036
赵丽颖拍林更新,电视剧,2024-04-11,壹周文艺,935,1,2900852
00后女生打工垮脸严重向公司索赔成功,社会,2024-04-11,西部决策,379,4,1040864
张杰女儿小名已被抢注商标,社会,2024-04-11,西部决策,288,1,1452628
三月三,社会,2024-04-11,节日君,457,1,2042855
黄金白银集体跳水,财经,2024-04-11,梨视频,318,1,2009883
我国电力系统充电宝创多项世界纪录,社会,2024-04-11,央视一套,576,3,1579335
福建立法规定妻子可查询配偶财产,社会,2024-04-10,澎湃新闻,356,1,1257463
热辣滚烫最终票房34.6亿,电影-华语电影,2024-04-10,淘票票,205,1,1192288
林更新cover女孩,明星,2024-04-10,青春娱乐台,156,1,2031757
北邮通报学生联名举报导师事件,社会,2024-04-10,新华社,87,2,2248975
北邮决定取消郑某研究生导师资格,社会,2024-04-10,新华社,77,2,1403973
怎么避免被别人视奸,情感,2024-04-10,小谷的信箱,170,4,1061155
陈都灵恭喜考研上岸粉丝,明星,2024-04-10,娱乐有饭,105,4,1168801
龙年龙月龙日雪龙号归来,社会,2024-04-10,人民日报,111,3,1581515
赵丽颖拍林更新,电视剧,2024-04-10,壹周文艺,134,1,5219375
我国电力系统充电宝创多项世界纪录,社会,2024-04-10,央视一套,13,3,1011965
中国第40次南极考察队凯旋,社会,2024-04-10,央视新闻,250,3,1378975
青3选手蒋智豪患肺癌,综艺,2024-04-10,北京卫视生命缘,423,4,1297337
暴雪官宣回归,游戏,2024-04-10,新浪游戏,559,1,8137083
轻工业生产回升盈利改善,财经,2024-04-10,经济日报,20,3,1335182
神州春色美,社会,2024-04-10,新华社,155,3,1103589
演员刘雨欣吐槽在美国真的不敢生病,明星-内地,2024-04-10,大象文娱,272,2,1431342
TFBOYS组合没解散,明星-内地,2024-04-10,圈内教父,309,4,1113606
28岁女子怀孕其妈妈喜极而泣,社会,2024-04-10,潇湘晨报,928,1,1278729
韩国溺水幼童遭11家医院拒收后死亡,财经,2024-04-10,新浪财经,433,2,1299407
网易暴雪复婚,游戏,2024-04-10,新浪游戏,430,2,2705906
鲶鱼须为何备受初中女生追捧,社会,2024-04-10,头条新闻,363,4,1109364
最美人间四月天,社会,2024-04-10,全国广电新媒体联盟,257,3,1396405
今天的龙含量好高,社会,2024-04-10,央视新闻,506,1,2135067
SM本月已有70名员工辞职,明星-日韩,2024-04-10,搜狐韩娱,270,4,1113956
张杰住在女生宿舍冉莹颖住在男生宿舍,明星,2024-04-10,三个四娱乐,347,2,1109106
隐瞒家人复读一年成功上岸,搞笑,2024-04-10,阿呆与瓜,305,2,1262723
长江流域中分布400多种鱼类,社会,2024-04-10,央视一套,644,3,2096260
林更新片场把赵丽颖亲腿麻了,电视剧,2024-04-10,综艺少年的日常,59,4,1009582
入职高校行政岗后滤镜碎了,社会,2024-04-10,新浪新闻,167,4,1027694
23岁女歌手因心力衰竭去世,音乐,2024-04-09,红星新闻,377,2,1092236
11年前狂购黄金的中国大妈解套了,财经,2024-04-09,中新经纬,229,1,1383441
离职后旅居大理第二天想回家了,搞笑,2024-04-09,大脑切片,144,1,1175852
陈赫直播回应撮合林更新赵丽颖,明星,2024-04-09,青春娱乐台,387,1,1141657
黄多多ins,明星,2024-04-09,搜狐娱乐,206,1,1991379
春日郁金香壁纸上新,社会,2024-04-09,人民日报,229,3,1049446
黄磊首谈儿子,综艺-内地综艺,2024-04-09,鲁豫有约,278,1,1662909
比亚迪卖一辆车净赚9000元,财经,2024-04-09,凤凰网财经,418,1,1605453
章若楠原名,明星,2024-04-09,娱乐有饭,114,2,1049415
欧阳娜娜归来仍才23岁,明星-港台,2024-04-09,仙女安利社,326,1,1483533
刘昊然否认和陈思诚绑定,明星,2024-04-09,梨视频,248,1,1122176
如何将旧金山愿景转为实景,社会,2024-04-09,央视新闻,242,3,1213814
赵丽颖提议的删掉父女相认戏台词,电视剧-国产剧,2024-04-09,今日星刊,429,1,1502013
王一博托姐公开秀恩爱,明星-内地,2024-04-09,影视扒爷,865,1,1557871
张元英连转两次圈,明星-日韩,2024-04-09,解忧剧场,391,2,1124601
小米公司深夜连发三文,社会,2024-04-09,究竟视频,321,1,2371874
ZARA回应撤出中国传闻,财经,2024-04-09,梨视频,280,1,1414058
我国首口超5000米深层地热科学探井,社会,2024-04-09,央视一套,630,3,1309485
金价又新高囤金人却慌了,社会,2024-04-09,新浪新闻,248,2,1230861
朱婷官宣回归中国女排,体育,2024-04-09,网易体育频道,684,1,1711074
感动中国2023年度人物,社会,2024-04-09,央视新闻,449,3,1157415
孙亚龙确诊中风,游戏,2024-04-08,英雄联盟神吐槽,277,1,1523249
iPhone闹钟正确设置方法,情感,2024-04-08,小谷的信箱,195,2,1267705
中医建议大家不要盲目的防晒,搞笑,2024-04-08,段子手黎吧啦,247,2,1930217
官方通报女子半截身子卷入扶梯,社会,2024-04-08,新浪新闻,110,4,1115573
赵丽颖曾推荐刘宇宁演与凤行,明星,2024-04-08,新浪明星,100,2,1757061
感动中国2023年度人物,社会,2024-04-08,央视新闻,163,3,1605094
王一博托姐公开秀恩爱,明星-内地,2024-04-08,影视扒爷,226,1,4068224
朱婷官宣回归中国女排,体育,2024-04-08,网易体育频道,43,1,2105025
这个春天遇见美好成为美好,社会,2024-04-08,新华网,133,3,1343801
浙江34岁律师被歹徒袭击身亡,社会,2024-04-08,沸点视频,348,2,1145518
王一博说个人演唱会OK,明星,2024-04-08,娱乐有饭,209,2,1171926
周梓倩自曝正骨被性骚扰,明星,2024-04-08,芒果剧探,185,1,1229111
第一次见工作室捶正主,明星,2024-04-08,新剧有梗,412,1,1402645
iPhone16最新高清渲染图,财经,2024-04-08,老板联播,321,1,1184595
流动的中国处处是风景,社会,2024-04-08,央视网,237,3,1473409
南昌公交事故司机当时心脏不适失去意识,社会,2024-04-08,央视新闻,293,2,1053849
邯郸案3人将面临故意杀人罪基本刑罚,社会,2024-04-08,央广网,385,1,1307589
苹果内鬼至少泄密6款苹果产品,科技,2024-04-08,老板联播,363,1,1424581
仝卓工作室直播了,社会,2024-04-08,西部决策,349,4,1373087
仝卓工作室曝仝卓差税被查,社会,2024-04-08,板扎在线,522,1,1734053
南昌公交和行人碰撞3人死亡,社会,2024-04-08,央视新闻,146,2,1436691
中国新兴文旅迎春勃发,社会,2024-04-08,央广网,240,3,1819227
邯郸初中生被害案3人被刑事追诉,社会,2024-04-08,央视新闻,207,1,11827844
有一种震撼的浪漫叫长城山花开,社会,2024-04-08,人民日报,23,3,1754814
文旅消费如何从开门红走向长红,社会,2024-04-08,央视新闻,701,3,1944340
肖战早期与素人合照,明星-内地,2024-04-08,剧综少主爱追星,632,1,1025219
日本天皇独女被曝遭受过校园霸凌,社会,2024-04-08,头条新闻,70,4,1107217
仝卓工作室公开讨债,社会,2024-04-08,梨视频,486,1,1055487
我倒要看看25年元旦会怎么调休,搞笑,2024-04-07,搞笑小赖赖,230,2,1317736
第一批去埃及旅行的人快被骗到裸奔了,社会,2024-04-07,新浪热点,492,1,1498534
小米定金事件暴露了成年人的耍赖心态,社会,2024-04-07,红星视频,226,1,1654606
河南某高校副科长被举报聚众淫乱,社会,2024-04-07,头条新闻,119,2,1031211
吴江涛你做的好事藏不住了,社会,2024-04-07,新华社,296,3,1095313
肖战早期与素人合照,明星-内地,2024-04-07,剧综少主爱追星,73,1,1143642
想当行长继承家产男孩父亲确为行长,社会,2024-04-07,央广网,539,1,2624934
新疆拜城5.4级地震,社会,2024-04-07,央视新闻,269,4,1215427
海南首个卫星超级工厂项目加快推动,科技,2024-04-07,央视一套,92,3,1178419
文旅消费如何从开门红走向长红,社会,2024-04-07,央视新闻,3,3,1079630
Jiejie回来了,游戏,2024-04-07,兔玩游戏,214,5,1151268
库迪咖啡创始人被强执,社会,2024-04-07,贝壳财经,363,2,1493309
春花唤醒了人间最美的季节,社会,2024-04-07,央视网,248,3,1451742
专家建议允许不合适的公务员辞职,财经,2024-04-07,新浪财经,397,1,1592989
女子投诉小米SU7未交付掉漆,社会,2024-04-07,冷暖视频,102,5,1079252
这个清明119000000人次出游,社会,2024-04-07,新华社,340,3,1377830
上个破班而已别把自己搭进去,情感,2024-04-07,职场达人林贤风,80,4,1020518
旅游专列也卷起来了,社会,2024-04-07,央视新闻,235,3,1402622
好声音起诉李玟经纪公司将开庭,社会,2024-04-07,中国网看点,192,2,1564982
公务员部分岗位年龄调整到40周岁,财经,2024-04-07,新浪财经,334,4,1238855
五一假期前后都要调休上班,社会,2024-04-07,新浪热点,270,2,1884605
提灯定损事件后当地民宿遭大量退订,社会,2024-04-07,新浪热点,172,2,1360643
欧阳娣娣第八名出道,明星-内地,2024-04-07,星前线,249,1,1278168
爱奇艺2024首部破万剧,电视剧-国产剧,2024-04-07,剧综少主爱追星,705,1,1389612
一起打卡春天里的中国,社会,2024-04-07,新华网,688,3,1450619
长期戴耳塞睡觉的人最后怎么样了,社会,2024-04-07,头条新闻,639,1,1500062
商品房以旧换新政策落地,社会,2024-04-07,央视财经,174,1,1057979
日本天皇独生女成为月薪7千的打工人,社会,2024-04-07,新浪热点,604,1,1019854
兰大回应虐猫考生进调剂名单,社会,2024-04-06,新浪新闻,453,1,2198020
放假三天躺了三天,搞笑,2024-04-06,嘻嘻小丸纸,338,4,1335797
千万不要买樱花味食物,社会,2024-04-06,新浪新闻,338,1,1674706
林更新回应和赵丽颖三搭,电视剧-国产剧,2024-04-06,偶像日报,323,1,1643193
字字不提钱句句都是钱,综艺,2024-04-06,央视新闻,166,1,1170132
将门毒后请肖战迪丽热巴会爆吗,电视剧,2024-04-06,娱理,131,2,1353311
赵奕欢被李菲儿逼哭,综艺,2024-04-06,新剧有梗,138,1,1647628
一起打卡春天里的中国,社会,2024-04-06,新华网,101,3,1448510
爱奇艺2024首部破万剧,电视剧-国产剧,2024-04-06,剧综少主爱追星,110,1,2304006
长期戴耳塞睡觉的人最后怎么样了,社会,2024-04-06,头条新闻,128,1,1772074
追风者破万,电视剧,2024-04-06,壹周文艺,107,1,1336904
孙亚龙进抢救室,游戏,2024-04-06,英雄联盟神吐槽,304,1,1534471
踏青赏花游热度增超700%,财经,2024-04-06,央视财经,16,3,1069003
假期返程安全行车攻略,社会,2024-04-06,人民网,313,3,1389984
林更新与凤行杀青哭成狗,电视剧-国产剧,2024-04-06,剧综少主爱追星,404,1,1022624
吴宣仪认证自己很姬,明星,2024-04-06,全娱乐揭秘,394,1,1307989
DNA比对成功烈士找到亲人,军事,2024-04-06,央视军事,54,3,1057358
孙俪大提琴一级考出来了,明星-内地,2024-04-06,正牌娱乐,462,1,1347371
藏在古建筑里的春天,社会,2024-04-06,央视新闻,247,3,1055069
广州暴雨,社会,2024-04-06,新浪广东,223,1,1352722
孩子们将碧空版如愿唱给空军英烈,社会,2024-04-06,人民日报,702,3,1175517
47岁未婚未育女性的生活状态,搞笑,2024-04-06,大脑切片,92,1,1845607
暧昧过后没在一起才是绝杀,情感,2024-04-05,人间清甜,377,2,1186293
香港发现首例人类感染猴疱疹病毒,社会,2024-04-05,西部决策,423,1,1642146
孩子们将碧空版如愿唱给空军英烈,社会,2024-04-05,人民日报,123,3,1499499
爱奇艺没有一台笔电吗,明星-内地,2024-04-05,追剧少女栗子猫,115,2,1498933
体制内什么人设最吃香,搞笑,2024-04-05,我和奇葩室友的日常,54,4,1228792
雷军送张颂文的SU7真车现身,明星,2024-04-05,西部决策,528,1,1849886
哑舍开机官宣,电视剧,2024-04-05,剧集哑舍,393,2,1293215
姜爷爷回韩国了,社会,2024-04-05,四川观察,539,2,1094873
清明版如愿致敬先辈,社会,2024-04-05,央视新闻,751,3,1309601
Doinb被偶遇,游戏,2024-04-04,兔玩游戏,378,2,1444911
比跷二郎腿伤害更大的坐姿,搞笑,2024-04-04,嘻嘻小丸纸,266,1,1345614
岳父母要求继承女婿父母留下的房产,社会,2024-04-04,第一现场,435,1,1704923
沈璃行止圆房完整版,电视剧,2024-04-04,追星手记,142,4,1102832
终于在高铁上发疯了,搞笑,2024-04-04,摸鱼掌门人,339,2,1020448
古诗词里的清明意境超美,社会,2024-04-04,央视新闻,189,3,1159563
徐艺洋发了和黄子韬的合照,综艺,2024-04-04,蜀黍说娱乐,223,1,1995457
黄晓明自曝胖了30斤,综艺-内地综艺,2024-04-04,明星小闹腾,302,2,1140194
胡一天 之前对你太大声了,电视剧,2024-04-04,仓酱_,462,1,1760242
今年清明为啥是4月4日,社会,2024-04-04,人民日报,323,1,1728980
在春天思念你们,社会,2024-04-04,新华社,56,3,1044752
姜爷爷希望福宝回中国不要改名字,社会,2024-04-04,看看新闻KNEWS,424,2,1191993
原来清明并不是放三天补一天,搞笑,2024-04-04,我和搞笑男的日常,639,1,2102011
先辈炽热滚烫的信仰我们永远记得,社会,2024-04-04,央视新闻,247,3,1130495
三十岁才会发现戴珍珠的美,情感,2024-04-04,阿侃,441,4,1041444
福宝小屋布满竹子笋笋苹果胡萝卜,社会,2024-04-04,新华社,384,2,1300561
王婆说媒已婚男妻子深夜发视频哭诉,社会,2024-04-04,新浪热点,471,2,1345844
各大平台禁止售卖分装化妆品,社会,2024-04-04,头条新闻,311,1,1551813
春和景明一草一木皆是思念,社会,2024-04-04,央视新闻,129,3,1134744
拍吻戏不张嘴,其他,2024-04-04,娱乐达达子,363,4,1237500
清明祭英烈家国永念,社会,2024-04-04,人民日报,239,3,1317172
日本地震,社会,2024-04-04,人民日报,183,1,1167614
丈夫称杨雪发病16天已失去治疗机会,社会,2024-04-04,白鹿视频,346,1,1648934
上厕所时马桶居然着火了,搞笑,2024-04-04,爆笑哈逗,346,2,1106582
福宝回家了,社会,2024-04-04,红星新闻,756,1,1188156
春天很好只是太想你,社会,2024-04-04,新华网,492,3,1244202
名创优品下架chiikawa不当视频,财经,2024-04-04,梨视频,634,1,1360041
韩素希被曝校园暴力,明星-日韩,2024-04-04,看韩影,108,1,1007616
家国永念致敬英雄,社会,2024-04-04,新华社,171,3,1036330
清明是唯一一个以节气命名的节日,社会,2024-04-03,央视网,215,3,1366628
胃癌就是这么一口一口吃出来的,健康-养生,2024-04-03,生命时报,534,4,1321301
福宝路上带的竹子没吃完,社会,2024-04-03,央视新闻,212,5,1085076
福宝顺利抵达成都,社会,2024-04-03,央视新闻,268,2,1769680
金价飙涨女子卖了60多万股票买金条,社会,2024-04-03,钱江晚报,435,1,1799670
赵丽颖林更新情头,电视剧-国产剧,2024-04-03,吃瓜卫视,307,4,1060204
花莲地震骨灰坛被甩出骨灰全混了,社会,2024-04-03,时间视频,133,4,1097852
家国永念致敬英雄,社会,2024-04-03,新华社,73,3,1543152
福宝回家了,社会,2024-04-03,红星新闻,268,1,8556544
名创优品下架chiikawa不当视频,财经,2024-04-03,梨视频,111,1,1845395
日本核污水或于本月到达我国沿海,社会,2024-04-03,新浪热点,74,1,1781526
春天很好只是太想你,社会,2024-04-03,新华网,16,3,1447321
张若昀唐艺昕公开恋情的原因,综艺,2024-04-03,向上娱乐,456,1,1426108
王大陆家墙震裂了,明星,2024-04-03,娱乐有饭,294,2,1390917
清明给英烈写句话,社会,2024-04-03,人民日报,493,3,2258841
4月和5月离职好亏,搞笑,2024-04-03,甜仔小新,241,1,1575509
台湾花莲县海域7.3级地震,社会,2024-04-03,人民日报,720,1,36875084
网传小学生称我爷爷爸爸妈妈都是行长,社会,2024-04-03,头条新闻,234,1,2014422
王婆说媒换人,社会,2024-04-03,梨视频,292,1,1788644
周杰伦亲历台湾地震称晃到不行,社会,2024-04-03,红星新闻,349,2,1546598
吴京谢楠恋情被自己公司记者拍到,综艺,2024-04-03,猹无此妹,207,2,1495060
我国成功发射遥感四十二号01星,社会,2024-04-03,央视新闻,107,3,2418058
胖东来金价刚涨到593元,财经,2024-04-03,梨视频,223,4,1182283
上海女婿阿福宣布离婚,时事,2024-04-03,微观上海_SH,335,4,1429181
日本海啸,社会,2024-04-03,中国新闻网,467,1,3012422
今天上班只干一件事,职场,2024-04-03,新浪江苏,399,2,3054927
台湾一豪宅顶楼游泳池变瀑布,社会,2024-04-03,新浪新闻,308,4,1230120
台湾花莲地震已致4死,社会,2024-04-03,央视新闻,236,6,1090167
盛一伦家中震感,明星,2024-04-03,正牌娱乐,249,4,1330044
江西风雹灾害7人死亡,社会,2024-04-03,央视新闻,163,4,1459667
小学生走失被带去派出所后搞起吃播,公益,2024-04-03,安徽公安在线,450,10,1656812
我国发布海啸红色警报,社会,2024-04-03,北京晚报,390,2,4367146
台湾花莲县海域再发生6.0级地震,社会,2024-04-03,人民日报,290,8,1322772
冉莹颖回忆孕期上岸北大,社会,2024-04-03,梨视频,263,5,1308587
台湾又发5.9级地震,社会,2024-04-03,央视新闻,270,5,2262765
海啸到达日本冲绳与那国岛,社会,2024-04-03,北京日报,219,7,1390744
台湾地震死亡人数升至2人,社会,2024-04-03,新浪新闻,57,7,1148603
直播福宝回国,社会,2024-04-03,央视新闻,236,6,2120770
中非互联网发展与合作论坛,社会,2024-04-03,中国日报网,695,3,5988050
放三天补一天的意义是什么,搞笑,2024-04-03,我和奇葩室友的日常,664,1,1153444
开钟点房的到底是些什么人,社会,2024-04-03,头条新闻,599,1,1651053
台湾连发3次地震,社会,2024-04-03,央视新闻,112,8,1207945
南昌,地区,2024-04-03,,192,2,1795714
南京震感,社会,2024-04-03,,119,13,1161189
台湾附近7.4级左右地震,社会,2024-04-03,央视新闻,90,1,51199711
福州震感,社会,2024-04-03,福州头条,59,14,1181575
福建震感,社会,2024-04-03,人民日报,72,2,3834680
日本发生7.5级地震,社会,2024-04-03,大河报,31,2,13671256
0作品却涨粉400万,情感,2024-04-03,又有好东西,530,1,1169826
日本地震,社会,2024-04-03,人民日报,1,1,1007563
台湾嘉义县发生4.2级地震,社会,2024-04-03,中国蓝新闻,65,2,22702891
中美关系要不折腾不挑事不越界,时事,2024-04-03,央视新闻,489,1,1403062
赵小棠抑郁了两年,综艺,2024-04-02,综艺教主,576,1,1579514
放三天补一天的意义是什么,搞笑,2024-04-02,我和奇葩室友的日常,441,1,3428305
中非互联网发展与合作论坛,社会,2024-04-02,中国日报网,490,3,1542538
0作品却涨粉400万,情感,2024-04-02,又有好东西,284,1,1951491
女子在母亲出殡当天被哥哥要求放弃遗产,社会,2024-04-02,点时新闻,218,2,1111699
雷军担心的事还是发生了,汽车,2024-04-02,Tech产经网,91,1,1319683
省考成绩,教育,2024-04-02,辽源中公教育,354,5,1015454
宋昰昀承认校园暴力,明星-日韩,2024-04-02,搜狐韩娱,353,2,1304548
华为已撤回遥遥领先商标申请,互联网,2024-04-02,新浪科技,290,2,1059082
唐一军接受审查调查,时事,2024-04-02,北京青年报,270,1,2020025
女子入职体检发现怀孕后被拒录用,社会,2024-04-02,头条新闻,562,1,2168070
99年女孩两年不上班逛吃30个城市,社会,2024-04-02,田野视频,496,2,1355319
南昌,地区,2024-04-02,,184,2,1023214
伊朗外长称已给美国传话,社会,2024-04-02,总台环球资讯,299,2,1272650
华晨宇9年前就拒绝月经羞耻,明星-内地,2024-04-02,仙女安利社,374,1,1996109
强对流天气应该如何避险,社会,2024-04-02,人民日报,299,3,1362331
任正非据传下禁令一句遥遥领先罚款一万,财经,2024-04-02,界面新闻,87,1,2010212
小米SU7退订率40%,财经,2024-04-02,新浪财经,33,1,2047728
万千气象看云南,社会,2024-04-02,新华网,610,3,1450851
市政协委员撞死人大代表获刑15年,社会,2024-04-02,头条新闻,192,1,2254251
伊朗驻叙领馆及大使官邸遭以军空袭,时事,2024-04-02,CCTV国际时讯,124,2,1031657
飓风坠楼3条人命迁出江西贪腐第一大案,时事,2024-04-02,凤凰网,40,2,1639600
朋友整个孕期抽了48管血,搞笑,2024-04-01,我和搞笑女的日常,291,4,1144292
6个月婴儿雨夜爬上马路被接力守护,社会,2024-04-01,央视新闻,294,4,1086270
郑爽若故意隐瞒转移财产或被判刑3年,社会,2024-04-01,点时新闻,313,1,1836724
冯绍峰谈到儿子眼圈红了,电影,2024-04-01,新浪电影,136,1,1924419
新生蔡元培莫言被北大拟录取,教育,2024-04-01,梨视频,360,1,1260806
男朋友婚前隐瞒他7年前坐过牢,搞笑,2024-04-01,别偷看我的摸鱼日记,262,2,1518514
旅日大熊猫爽爽死亡,社会,2024-04-01,九派新闻,497,2,2156262
法院认定郑爽无财产可供执行,社会,2024-04-01,西部决策,542,1,3545974
万千气象看云南,社会,2024-04-01,新华网,77,3,1817704
张颂文参加婚礼吃上肘子,明星,2024-04-01,白鹿视频,365,2,1186500
雄安新区7岁了,社会,2024-04-01,央视新闻,316,3,1512308
南昌,地区,2024-04-01,,119,2,1297315
一百家站姐发了陈都灵,明星-内地,2024-04-01,灰兔子大叔,259,2,1001846
