title,label,time,host,continue,sort,hot
顺丰回应7万元爱马仕运输中烧毁,社会,2023-02-15,西部决策,384,3,1151641
赵露思工作室维权声明,明星,2023-02-15,娱记大魔王,321,4,1272399
陈飞宇工作室维权声明,明星,2023-02-15,娱乐有饭,171,1,3113163
刘亚仁涉嫌逃兵役,明星,2023-02-15,娱乐小浪花er,193,2,1818171
王鹤棣吃炸串吃到蓝羽上手阻拦,电影,2023-02-15,小央视频,320,4,1032974
蔚来回应试驾致母子一死一伤,社会,2023-02-15,封面新闻,380,2,1485779
iPhone15Pro或带来全新金色,互联网,2023-02-15,新浪热点,407,2,1087730
医保,新,2023-02-15,,85,1,2660163
月入5000是什么水平,情感,2023-02-15,苏汶涛,138,2,1584326
中国春耕图鉴,社会,2023-02-15,人民日报,275,3,1847822
邓超问节目组多打四个哈是会累到你吗,综艺,2023-02-15,麻花娱乐,256,4,1339165
鹿晗被老虎吓到,综艺,2023-02-15,知名美少女观众,213,4,1382851
月入5000能不能击败95%的人,财经-宏观经济,2023-02-15,新浪热点,137,4,1153662
12岁脑瘫女孩被同岁亲戚性侵,社会,2023-02-15,凤凰网,238,4,1196069
提前还贷20万或将节省利息17万,互联网,2023-02-15,麦穗财经,162,1,2097682
18岁喜欢的人27岁还在身边,社会,2023-02-15,江畔视频,374,1,2035106
震后救援中的中国身影,社会,2023-02-15,央视新闻,678,3,1863525
顺丰寄爱马仕包运输中被烧毁,财经,2023-02-15,黑猫投诉,659,1,1281482
卤味三巨头利润全暴跌,财经-其他,2023-02-14,老板联播,360,5,1133330
满江红周边下架,电影,2023-02-14,吃瓜综艺鹅,460,1,2575364
两名主播涉嫌偷逃税款被罚,社会,2023-02-14,中国新闻网,319,5,1208987
韩国民众向土耳其捐赠大量脏衣服,社会,2023-02-14,人民日报海外版-海外网,265,6,1192063
68岁环卫工被茶百道员工殴打住院,社会,2023-02-14,中国新闻周刊,223,6,1243582
王传君说大家对王一博有一些误解,明星,2023-02-14,新浪大文娱,233,4,1344166
鸭脖为何卖不动了,互联网,2023-02-14,互联网那些事儿v,239,6,1101450
赵丽颖推荐王梓薇客串与凤行,电视剧,2023-02-14,娱乐宇宙派,109,5,1157064
男子反复缴费套取蚂蚁森林能量被封号,财经-产业公司,2023-02-14,财经网,183,2,2005817
情人节偶遇黄子韬徐艺洋,明星,2023-02-14,娱乐圈狂人,151,11,1028024
朴敏英被传唤调查,明星-日韩,2023-02-14,搜狐韩娱,396,2,2196369
接吻时身体会有这些反应,社会,2023-02-14,凤凰网健康,466,2,1371446
邓超情人节送孙俪一盆菜,明星,2023-02-14,娱乐课代表,242,6,1045352
专家建议短期别喝产地俄亥俄的牛奶,财经,2023-02-14,中新经纬,397,2,1457898
蔚来试驾车冲进人行道致一死一伤,社会,2023-02-14,新浪新闻,175,5,1215134
情人节,情感,2023-02-14,节日君,543,1,1341461
无人机看跨海大桥穿越碧海流云,社会,2023-02-14,新华社,220,3,1956793
王力宏公司被冻结901万存款,财经,2023-02-14,中新经纬,270,4,1080554
不明飞行物,社会,2023-02-14,四川新闻网,248,2,1995188
广西万达茂捅人案正在调查处理,社会,2023-02-14,央视网,129,1,2903104
黄景瑜白百何王丽坤新片情人节海报,电影,2023-02-14,玩儿电影,206,4,1210329
周黑鸭业绩大降超90%,财经,2023-02-14,中新经纬,428,2,1769519
河南多地发生巨响,社会,2023-02-14,新浪河南,249,1,1071273
中国乡村振兴定能结出累累果实,社会,2023-02-14,央视新闻,412,3,2032283
美俄亥俄州大量动物突然死亡,时事,2023-02-14,共青团中央,487,1,1866980
杨洋再不进组这就是你的归宿,明星,2023-02-14,煎果娱乐,424,2,1767937
28岁单身女孩情人节前崩溃大哭,社会,2023-02-14,沸点视频,389,4,1166600
张子枫胡先煦新片演夫妻,电影,2023-02-14,新浪电影,369,1,2232243
爸爸因姜姓难取名给孩子叫去寒,社会,2023-02-14,山海视频,295,1,3146937
诺如病毒,政务,2023-02-14,疾控科普,379,1,1999111
女性面试被HR反复盘问性别歧视肉眼可见,法律,2023-02-14,法治日报,249,2,1640037
孕妇如厕时生产婴儿被卡蹲便器,社会,2023-02-14,西部决策,751,4,1181931
超20%大学生认为毕业后月薪能过万,互联网,2023-02-14,每天学点经济学,717,4,1372368
民众拍下俄亥俄州东巴勒斯坦城上空景象,社会,2023-02-14,微天下,255,2,1541286
中国救援队已营救多名被困者,社会,2023-02-14,人民日报,666,3,1657597
女子注射6针玻尿酸致残,社会,2023-02-13,央视网,415,2,1344839
Doinb爆料FPX寄了,游戏,2023-02-13,兔玩游戏,307,4,1045862
张颂文曾指导王一博演至尊宝,明星,2023-02-13,新剧有饭,369,4,1049809
刘耀文严浩翔三亚同框路透,明星,2023-02-13,新剧有饭,114,6,1262707
韩媒称日本或将发生9.1级地震,社会,2023-02-13,凤凰周刊,255,3,1448170
Cat女朋友,新,2023-02-13,,63,5,1264549
徐明浩锁骨部位骨折,明星,2023-02-13,饭圈少女苏大强,484,1,4112006
嘎子哥回应1999元手机1880元能买到,社会,2023-02-13,信号财经,393,2,1640678
女子车辆被强盛集团违停车挡住,社会,2023-02-13,水母网,323,4,1005912
贷款人离世后剩下房贷该如何处理,互联网,2023-02-13,第一财经日报,446,6,1319906
昺 让世界认识这个字,体育,2023-02-13,央视网,467,4,1410476
涵艺爆料LWX要转辅助,游戏,2023-02-13,兔玩游戏,165,4,1113378
狂飙钟阿四镜头已全部删除,电视剧,2023-02-13,财经网,459,4,1339092
金希澈就直播骂脏话道歉,明星,2023-02-13,娱小果,308,6,1376995
我国女性终身无孩率接近10%,社会,2023-02-13,财经网,462,2,2039452
衢州交警致歉,社会,2023-02-13,九派新闻,294,2,1868747
向着新目标奋楫再出发,社会,2023-02-13,人民日报评论,100,3,1699955
高启强陈书婷亲热戏被删,电视剧,2023-02-13,肥宅追剧快落水,455,1,3157333
日本地震,社会,2023-02-13,人民日报,312,1,1209681
王一博无名吃拿破仑花絮,明星-内地,2023-02-13,绵羊视频,274,6,1218446
王大陆遗憾妈妈没见过蔡卓宜,综艺-内地综艺,2023-02-13,半岛文娱,339,2,2162031
多设备登录被封号合理吗,财经,2023-02-13,老板联播,332,4,1748151
林志颖车祸后首次公开活动,明星,2023-02-13,东施飞行日记,380,1,2008105
修音也救不了的三字歌手,综艺-内地综艺,2023-02-13,宇宙冲浪独角兽,549,1,2832040
长期不吃早餐会降低大脑功能,社会,2023-02-13,央视网,375,5,1066989
Rihanna补妆,明星-欧美,2023-02-13,重头戏,394,1,2368448
五角大楼称F16战机又击落一空中物体,军事,2023-02-13,小央视频,374,4,1222145
杨蓉说这回为爱疯一回,电视剧,2023-02-13,西霍娱乐,284,5,1060095
徐志胜吐槽地铁太挤了,综艺-内地综艺,2023-02-13,中国网娱乐,156,4,1465508
官方准备击落山东海域不明飞行物,社会,2023-02-13,人民视频,818,1,2591327
超级碗,体育,2023-02-13,NFL橄榄球,308,4,1086890
专家谈房贷年龄期限可延长到80岁,财经,2023-02-13,中新经纬,158,4,1323021
林孝埈庆祝动作,体育,2023-02-13,咪咕体育,700,2,1280253
70岁阿姨微信被封哭诉会孤独终老,社会,2023-02-13,新浪新闻,696,2,1269900
中国救援人员加油保重,社会,2023-02-13,人民日报,687,3,1691826
回南天是南方人专属的痛,搞笑,2023-02-13,前方高能,223,4,1135716
农村老人为何不愿意进城养老,社会,2023-02-13,新浪热点,263,2,1103416
林孝埈500米两连冠,体育,2023-02-13,新浪体育,613,2,1386328
边亮付心童离婚,电视剧,2023-02-12,会火星剧,142,6,1060694
吴磊赵今麦芬兰雪地随拍,明星,2023-02-12,剧综之声,231,5,1179824
姐弟俩仿冒论文期刊四年牟利1800多万,社会,2023-02-12,北京日报都视频,297,4,1234623
哇唧唧哇新人原野撞脸龚俊,明星,2023-02-12,肥宅追剧快落水,258,5,1048156
熙妃回宫,明星,2023-02-12,班尼弟弟,217,7,1031668
土耳其震后救灾现场的中国身影,社会,2023-02-12,新华社,219,3,1790941
医生称大学生精子活力不如30岁男性,社会,2023-02-12,头条新闻,356,2,1259855
央美准考证模版用肖战照片,明星,2023-02-12,林黛玉正拔垂杨柳,443,4,1242395
人民网评狂飙演员曾涉毒,社会,2023-02-12,人民网,220,4,1064497
中国空间站第一视角看地球转动,社会,2023-02-12,人民日报,352,3,1807464
朱珠产后带孩子进组拍戏,明星-内地,2023-02-12,新京报文娱,281,4,1183098
男子吐槽15万装修婚房不如出租屋,社会,2023-02-12,新浪新闻,411,5,1140714
重庆一对情侣蹦极倒挂滞留半空,社会,2023-02-12,百姓关注,380,4,1441690
熬夜可能会导致大脑损伤提早,社会,2023-02-12,新华网,325,6,1177485
迪丽热巴婚纱大片,明星,2023-02-12,桃娱乐,105,1,4126824
李一桐郭晓婷当群演一天赚了288,明星,2023-02-12,剧综之声,775,5,1033780
狂飙王秘书也不是演的,电视剧,2023-02-12,小祖综,91,1,2178133
狂飙修改删除涉毒演员戏份,电视剧-国产剧,2023-02-12,中新文娱,726,1,7491718
狂飙涉毒演员含笑发文道歉,社会,2023-02-12,新浪新闻,210,1,4675541
2023春耕进行时,社会,2023-02-12,经济日报,701,3,1786926
杭州一套凶宅起拍单价2万你敢买吗,社会,2023-02-12,钱江晚报,694,2,1695390
狂飙钟阿四真的不是演的,情感,2023-02-12,子欤,649,1,1047684
可能被ChatGPT取代的10大职业,社会,2023-02-12,央视网,555,4,1054550
赵丽颖早期穆念慈定妆照,电视剧-国产剧,2023-02-11,新剧日常,375,1,1274877
RNG官宣教练Heart离队,游戏,2023-02-11,召唤师Park,296,5,1073186
程耳王一博二搭电影人鱼,明星-内地,2023-02-11,快乐星球鸭船长,168,5,1095394
武汉地铁3外籍男子横卧整排座位,社会,2023-02-11,新浪新闻,265,2,1129907
WBG战胜JDG,游戏,2023-02-11,英雄联盟手游赛事,95,4,1453040
狂飙严正声明,电视剧,2023-02-11,剧综大赏,101,2,3800024
刘大锤说张译是很纯粹的演员,电视剧,2023-02-11,剧星冲浪板,314,5,1056241
狂飙大结局以后最累的是高启兰,电视剧-国产剧,2023-02-11,顶流寡姐,468,1,1358749
郑永刚病逝,社会,2023-02-11,界面新闻,314,1,1708003
同心奋进新征程,社会,2023-02-11,人民网,342,3,1714517
俄称准备好与乌克兰无条件谈判,时事,2023-02-11,中国新闻网,418,1,1715728
蔡徐坤帮前队友收集打官司证据,明星-内地,2023-02-11,桃子娱乐,329,1,2061753
泰国夜市偶遇鞠婧祎,明星,2023-02-11,娱乐宇宙派,378,4,1158101
周也不会wink可以不wink,明星-内地,2023-02-11,新京报文娱,413,1,1336776
专家提醒每人一生只能捐精一次,互联网,2023-02-11,至简财经,463,1,1645458
张颂文拍立得买主回应,明星,2023-02-11,娱乐有饭,390,2,1365983
志愿者精子合格率不到20%,社会,2023-02-11,头条新闻,471,1,2121394
用汗水播下丰收的种子,社会,2023-02-11,新华社,244,3,1412526
中国首批缉毒松鼠即将上岗,社会,2023-02-11,央视网,373,2,1352721
孙俪工作室账号评论区,明星-内地,2023-02-11,叫我姨太好了,461,1,2217892
你好星期六今晚全员竞选金牌投资人,综艺,2023-02-11,湖南卫视你好星期六,267,4,1042594
广东河源市4.3级地震,社会,2023-02-11,央视新闻,267,2,3492177
多地现捐精倡议原因何在,社会,2023-02-11,新浪热点,372,4,1029143
SMTOWN曾反对加入中国成员,明星,2023-02-11,哎一股清流,769,2,1009100
穿越机视角看中国大桥多震撼,社会,2023-02-11,新华社,765,3,2592869
路人美国偶遇刘亦菲,明星,2023-02-11,闪光文艺,697,4,1206778
郑州某医院再现半蹲式窗口,社会,2023-02-11,头条新闻,687,1,1144991
易烊千玺被冻得双手握拳,明星,2023-02-11,饭里追剧,494,1,1209867
鹿晗夹克上好多袖子,综艺-内地综艺,2023-02-10,影视剧未央,364,6,1019584
迪丽热巴工作室晒维权通告,明星-内地,2023-02-10,新剧日常,555,1,4472118
张杰12年前陪小沈阳听歌错过洞房花烛夜,综艺,2023-02-10,娱乐八叫兽,273,4,1641593
胜利曾非法拍摄中国女性,明星,2023-02-10,娱乐小浪花er,353,2,1562262
唐小强葬礼将在伊斯坦布尔举行,社会,2023-02-10,九派新闻,416,4,1213031
年轻人为什么抛弃了QQ,互联网,2023-02-10,互联网那些事儿v,553,6,1003162
你的QQ号码是几位数,社会,2023-02-10,大河财立方,407,5,1241855
QQ首位用户找到了,财经,2023-02-10,老板联播,611,2,2318296
60秒速览神十五乘组首次出舱任务,社会,2023-02-10,新华社,649,3,3785149
易烊千玺直播,明星,2023-02-10,星姐微博,95,1,3904102
刘亚仁尿检结果阳性,明星,2023-02-10,圈里教父,316,6,1020034
狂飙片头被指抄袭,社会,2023-02-10,信号财经,429,4,1840656
婚纱店门口偶遇周扬青,明星,2023-02-10,圈外老鬼,235,4,1551519
杨迪 没想到传来了最坏的消息,综艺-内地综艺,2023-02-10,浪里看综艺,495,1,4843993
大理地震,社会,2023-02-10,,199,4,1010263
李易峰被代言商申请冻结80万财产,财经,2023-02-10,中新经纬,204,2,2525925
数千人申请领养废墟中出生女婴,社会,2023-02-10,九派新闻,312,6,1188454
唐小强被搜救到时已遇难,社会,2023-02-10,红星新闻,514,4,2173980
韩国维持对自中国入境者的防疫措施,社会,2023-02-10,中国新闻网,345,2,1277029
非正式会谈,综艺,2023-02-10,非正式会谈,428,2,1605343
狂飙剧中李响杯子掉落是无心的,电视剧,2023-02-10,央视网,404,2,1318636
大嫂出场即兴砸杯子磕坏楼梯,社会,2023-02-10,央视网,233,9,1018812
强信心稳经济促发展,社会,2023-02-10,经济日报,661,3,2867457
韩明起恢复发放中国公民短期签证,社会,2023-02-10,中国新闻周刊,118,6,1000965
中方不接受美方关于两国防长通话的提议,时事,2023-02-09,凤凰网,285,6,1080757
YG大楼现状,明星-日韩,2023-02-09,晨曦文娱,440,2,1662053
泫雅牙钻,明星,2023-02-09,剧综种草机,394,4,1140803
杨紫工作室倡议书,明星,2023-02-09,娱乐小浪花er,201,4,1068389
HYBE正式宣布参与收购SMTOWN,明星-日韩,2023-02-09,晨曦文娱,286,2,1422081
婚检有多重要,社会,2023-02-09,我苏特稿,295,5,1250538
叙利亚已收到千笔中国捐款,社会,2023-02-09,红星新闻,176,4,1041828
李恩曝少女神探导演与女生聊天记录,明星-内地,2023-02-09,青青草原小羊子,134,2,1255289
鞠婧祎喝椰子水视频,明星,2023-02-09,娱乐宇宙派,110,4,1406380
程潇泳装身材,明星,2023-02-09,娱乐小浪花er,278,4,1796837
刘若清回应一辈子不想见张译,明星,2023-02-09,毒舌馆长,481,4,1613297
胜利提前出狱,明星,2023-02-09,娱乐小浪花er,311,1,1812619
杜兰特加盟太阳,体育,2023-02-09,相信篮球,377,1,2672102
采取更多惠民生暖民心举措,时事,2023-02-09,央广网,214,3,1841260
陈乔恩艾伦吵架,综艺-内地综艺,2023-02-09,正在出圈,315,4,1144870
刘亚仁等51人被调查,音乐-日韩音乐,2023-02-09,新浪韩娱,200,4,1341341
曝HYBE收购SMTOWN股份,音乐,2023-02-09,钮祜禄流流,367,5,1275737
00后KTV必点曲目,音乐,2023-02-09,咪咕音乐,391,5,1023378
唐小强,综艺,2023-02-09,,532,1,1437827
男子欲试睡凶宅躺赚大钱被骗,社会,2023-02-09,西部决策,145,4,1351761
姜超扮演者说小五是张译加的戏,明星,2023-02-09,林黛玉正拔垂杨柳,411,2,1808918
2022年度退补税怎么办理,社会,2023-02-09,人民日报,537,3,1864177
张艺兴的刘海,明星,2023-02-09,幸福追综,339,5,1072017
张元英毕业照公开,明星-日韩,2023-02-09,顶流寡姐,348,1,1859276
央视评年轻人越来越反感专家,社会,2023-02-09,观察者网,314,1,3745109
赵今麦小香风营业照,明星-内地,2023-02-09,新京报文娱,120,5,1184002
刘亚仁涉嫌吸毒,明星,2023-02-09,娱乐小浪花er,858,1,6768058
安欣再现红色高跟鞋名场面,电视剧-国产剧,2023-02-09,追剧少女PDD,364,2,1341131
当事人承认相亲隔天结婚系炒作,社会,2023-02-09,西部决策,220,4,1484611
女子销毁毒狗药物时中毒身亡,社会,2023-02-09,头条新闻,223,1,1825430
张大大连麦的女网友疑似被家暴,明星,2023-02-09,熊猫娱乐网,371,1,2433203
陈妍希只看了梦华录前十集,综艺,2023-02-09,收视率贡献专家,702,2,1013435
1分钟感受春天的生机活力,社会,2023-02-09,人民日报,646,3,1572735
中国救援队从土耳其废墟救出一名孕妇,社会,2023-02-09,央视新闻,194,4,1006773
通勤时间过长会有什么影响,社会,2023-02-09,小央视频,210,2,1326080
马航MH17坠机案调查暂停,社会,2023-02-09,北京头条,598,1,1216204
收费3元一本代包书皮业务火了,社会,2023-02-08,指尖新闻,402,6,1150227
黄瑶扮演者程金铭发文,电视剧,2023-02-08,娱乐宇宙派,173,2,1664037
涉少女吸毒死亡案酒店暂停营业,社会,2023-02-08,济南时报,264,1,2217876
狂飙庆功宴,电视剧,2023-02-08,吃瓜姐妹,716,1,2353113
丢失两年的手机半夜仍被人试图解锁,社会,2023-02-08,沸点视频,297,2,1863358
开局之年第一课,社会,2023-02-08,人民日报,263,3,1831314
张译ip地址在海南,明星,2023-02-08,我东家的娱乐,413,4,1398935
3岁女童喊脚疼被确诊癌症晚期,公益,2023-02-08,猛犸新闻,443,7,1195212
台湾永远不可能成为一个国家,时事,2023-02-08,人民视频,451,2,1957557
詹姆斯NBA历史得分王,体育,2023-02-08,NBA,407,1,5576993
人勤春来早田间农事忙,社会,2023-02-08,新华社,312,3,2286994
鹿晗做中国乒乓表情包为邓超庆生,明星,2023-02-08,娱乐宇宙派,139,7,1040256
张颂文给后援会会长骨髓配型,明星,2023-02-08,娱星教父,144,5,1119486
女子应聘行政岗被要求只要单身,社会,2023-02-08,头条新闻,344,5,1143089
新冠病毒去哪了它会消失吗,社会,2023-02-08,新浪新闻,397,5,1292090
田亮女儿首获青少年世界排名,体育,2023-02-08,体育叨叨酱,359,2,1506225
詹姆斯认为自己是史上最佳球员,体育,2023-02-08,微观篮球,447,2,2344629
杨幂 要是有就再加麻加辣,电影-华语电影,2023-02-08,新浪大文娱,349,1,2596199
女生上班通勤4小时坐10趟地铁,社会,2023-02-08,山海视频,383,2,1790350
丈夫深夜崩溃痛哭妻子一把搂入怀,社会,2023-02-08,农民频道,323,5,1195791
我国结婚登记连续八年下降,互联网,2023-02-08,AI科技融媒,194,2,1786884
13岁男孩考试18分被父亲意外刺死,社会,2023-02-08,中国新闻网,191,2,1633897
嘉行2023艺人合集没有杨幂,明星-内地,2023-02-08,吃瓜追剧打豆豆,151,5,1136339
西安不倒翁小姐姐回应生娃面容憔悴,社会,2023-02-08,沸点视频,443,1,3141679
韩国申报的文化遗产来自日本,社会,2023-02-08,环球时报,319,2,1522616
法定婚龄降到18岁会提升初婚率吗,互联网,2023-02-08,每天学点经济学,101,1,4970921
流动的中国绽放着蓬勃活力,社会,2023-02-08,央视新闻,733,3,1874212
张译新闻联播镜头,明星-内地,2023-02-08,饭圈一姐蔡根花,654,1,1315156
女子用狂飙导演照片卖身葬父,社会,2023-02-08,梨视频,450,1,1137623
月入一万是什么水平,互联网,2023-02-08,互联网那些事儿v,449,1,1287926
狂飙是央八近九年收视第一,电视剧,2023-02-07,董小姐的追剧日记,551,2,1273575
肖战白百何捉妖记2后二搭,电视剧-国产剧,2023-02-07,内娱教父,414,4,1299717
中年裸辞意味着什么,电视剧,2023-02-07,晨报文艺,233,2,1020787
抖音入局外卖意味着什么,财经,2023-02-07,环球市场播报,314,4,1246759
杜华帮儿子要虞书欣签名照,明星-内地,2023-02-07,城市周刊娱评,149,4,1142033
第一次见双眼皮的小猫,搞笑,2023-02-07,人类高质量青年,320,2,1000491
疯驴子才25岁,明星,2023-02-07,在看的剧季,600,1,2128042
曝公司艺人不愿为李秀满发声,明星,2023-02-07,新浪娱乐,360,4,1067364
宋宁峰向张婉婷求婚,综艺,2023-02-07,新浪综艺,471,1,1887282
蔡徐坤头发已经褪色了,明星,2023-02-07,快乐追星的piggy,325,4,1048762
新郎回应结婚当天前女友组团拉横幅,社会,2023-02-07,沸点视频,102,1,2536196
美国89%的大学生都是用ChatGPT做作业,科技,2023-02-07,中国科技观察,457,4,1548722
10岁女孩文具店买到性暗示钥匙扣,社会,2023-02-07,澎湃新闻,453,2,2099026
刘亦菲洛杉矶街头被网友偶遇,明星,2023-02-07,剧星冲浪板,260,5,1641730
TFBOYS十周年演唱会附近酒店已被订完,明星,2023-02-07,热剧精彩,301,2,2926829
考过研的真看不得这个,搞笑,2023-02-07,打工人生存手册,334,4,1347042
新征程上满怀信心开新局展新貌,社会,2023-02-07,半月谈,272,3,2268889
妈妈给女儿寄100个水饺都独立包装,社会,2023-02-07,头条新闻,369,1,1609641
杨迪为唐小强祈祷,明星,2023-02-07,娱乐课代表,158,4,1490145
强震已致土耳其叙利亚超3000人遇难,社会,2023-02-07,央视新闻,286,1,1966777
太空视角看灯火里的中国,社会,2023-02-07,人民日报,678,3,1583411
中国女球员地震中幸免于难报平安,社会,2023-02-07,青流视频,671,1,1014250
肖战杀青抱着白百何转圈,明星-内地,2023-02-07,综艺在线网,197,1,2447974
男子称买蒙牛酸奶打开都是清水,社会,2023-02-07,信号财经,101,5,1009641
美方称发现第二个来自中国的气球,时事,2023-02-06,每日经济新闻,411,1,1869075
张译演反派吓到岳云鹏,电影-华语电影,2023-02-06,新京报文娱,195,2,1186060
杨紫绿色抹胸纱裙,明星-内地,2023-02-06,清风娱乐,265,1,1374366
福原爱向男友前妻道歉,明星,2023-02-06,娱乐课代表,393,1,2385904
土耳其附近发生8.0级左右地震,社会,2023-02-06,北京头条,313,1,1776681
男子结婚当天前女友们现场拉横幅,社会,2023-02-06,头条新闻,267,1,1265574
广东人会把肠粉淹死在酱汁里,社会,2023-02-06,央视网,170,2,1185602
中国游客被普吉岛旅行社负责人割伤,社会,2023-02-06,都市快报,126,1,1593900
土耳其大批运动员被埋废墟,时事,2023-02-06,凤凰网,223,1,1441690
王俊凯给车牌打码,明星-内地,2023-02-06,教父娱乐网,186,4,1315330
陈思诚说朱一龙太文质彬彬了,电影-华语电影,2023-02-06,内娱教父,336,4,1065061
30岁男子发现56岁老妈生二胎,社会,2023-02-06,手机上的新浪,224,5,1281991
男生骑车被劳斯莱斯撞倒笑出了声,社会,2023-02-06,新浪新闻,186,1,1373525
贾冰说我都这么狠了你们还想笑,社会,2023-02-06,央视网,482,2,1274954
连体女婴分离14年后长成健康少女,社会,2023-02-06,大米Video,405,1,1439278
学校组织学生徒步自费看满江红,社会,2023-02-06,济南时报,380,4,1328725
流动的中国活力,社会,2023-02-06,新华社,286,3,1656917
土耳其发生7.8级地震,时事,2023-02-06,环球网,545,1,1734265
月收入5千以下占总人口95%,社会,2023-02-06,新浪新闻,141,1,1559224
九价HPV疫苗现捆绑销售,社会,2023-02-06,每日经济新闻,453,1,1860285
林志颖违规停车被罚款,明星-港台,2023-02-06,重头戏,356,1,2291584
66岁大叔和女友买新房名字没自己,社会,2023-02-06,小莉帮忙,304,4,1027084
伊拉克女网红被父亲荣誉处决,社会,2023-02-06,Vista看天下,134,1,1831084
网传TFBOYS十周年线下演唱会确定,明星-内地,2023-02-06,新剧日常,383,2,1338197
母亲回应儿子被邻居放炮炸伤致截肢,社会,2023-02-06,西部决策,347,1,1904759
何广智打算换了72平的大房子,综艺,2023-02-06,新浪综艺,403,1,2278438
曝李秀满被公司单方面宣布退出,明星,2023-02-06,会火,303,2,1560220
任泽平建议法定婚龄降到18岁,财经,2023-02-06,新浪财经,103,1,2103386
韩媒评林孝埈双冠,体育,2023-02-06,新浪体育,380,2,1381757
坐上高铁去滑雪,社会,2023-02-06,中国铁路,330,3,1450628
李承铉脖子上挂的是奶嘴,明星-内地,2023-02-06,晨报文艺,288,4,1171270
胜利将于2月11日出狱,明星-日韩,2023-02-06,重头戏,267,2,1220977
苹果2024年或推出无接口设计iPhone,财经,2023-02-06,老板联播,285,2,1036376
专家称成年人有权做个废物,社会,2023-02-06,头条新闻,117,4,1231035
多地中考取消男生1000米女生800米,教育,2023-02-06,人民网,286,1,1613447
段奥娟瘦了好多,综艺-内地综艺,2023-02-06,中新文娱,753,1,1491266
欧文被交易至独行侠,体育,2023-02-06,炙篮球,339,2,1083291
林孝埈中国队首金,体育,2023-02-06,新浪体育,673,1,2062355
24岁女子嫁85岁老头还要为其生子,社会,2023-02-06,头条新闻,211,4,1229115
黄多多晒与同学比心合照,明星-内地,2023-02-06,高能剧综,228,4,1226736
甜甜的笑容温暖了这个冬天,社会,2023-02-06,央视新闻,170,3,1229197
周深被人踩了,综艺-内地综艺,2023-02-06,新浪综艺,579,1,1331032
元宵喜乐,社会,2023-02-06,人民网,453,3,1168851
玖月奇迹王小玮嫦娥造型唱花腔,综艺,2023-02-05,浪里看综艺,155,4,1861306
顾客质疑158元烤鸭上桌仅有半只,社会,2023-02-05,都市时报,238,7,1013318
湖南高速多车相撞致16死66伤,社会,2023-02-05,新浪新闻,421,1,2600586
年轻人报复性还房贷银行为何急了,社会,2023-02-05,新浪热点,306,5,1037685
肖战吃的是儿童元宵,明星-内地,2023-02-05,顶流寡姐,283,4,1592695
工资不高但想留下来的城市,情感,2023-02-05,阿侃,198,4,1655988
格莱美,音乐-欧美音乐,2023-02-05,新浪音乐,103,4,1019010
上海平均月薪10605元,社会,2023-02-05,每日经济新闻,456,1,1608798
央视元宵晚会,综艺,2023-02-05,春晚,181,2,2109048
元宵晚会节目单,综艺,2023-02-05,春晚,281,5,1246487
边伯贤退伍后首发文,明星,2023-02-05,草莓牛奶味的Haru,264,1,1088781
狂飙制片人和疯驴子聊成毅,明星,2023-02-05,新剧有饭,395,1,1869544
儿子监控中看到老父从房顶摔下瞬间泪奔,社会,2023-02-05,沸点视频,255,2,1186995
蔡文静说成毅经常手机欠费,综艺-内地综艺,2023-02-05,高能剧综,263,4,1042679
今天元宵节,社会,2023-02-05,央视新闻,391,3,3746295
张颂文电子签名,明星,2023-02-05,渡边小鲜肉,469,5,1018175
