title,label,time,host,continue,sort,hot
王楚钦领衔WTT2023年度十佳球,体育,2023-12-31,咪咕体育,49,40,1191276
11个王俊凯,综艺-内地综艺,2023-12-31,浪里看综艺,227,1,12920979
还得是林俊杰,明星,2023-12-31,壹周文艺,126,4,5445912
湖南卫视跨年晚会,综艺,2023-12-31,湖南卫视跨年晚会,261,1,11513949
当代年轻人的跨年现状,搞笑,2023-12-31,科技杨同学,141,18,2483603
四川自贡发生3.2级地震,社会,2023-12-31,中国新闻网,191,7,3045649
女子1张彩票中奖571次总计860万,社会,2023-12-31,星视频,282,6,3087475
韩国地铁站竟然有宋词,搞笑,2023-12-31,李茜芊,111,10,3101572
烟花,闲趣,2023-12-31,节日君,261,5,4054819
上海迪士尼发文致歉,社会,2023-12-31,白鹿视频,209,2,4069606
淘宝全网找水晶鞋公主,社会,2023-12-31,妙龄Fashion,45,15,2548864
冷门歌手孙燕姿,搞笑,2023-12-31,外卖小哥金城武,32,6,2121619
跨年文案,社会,2023-12-31,节日君,790,2,3089687
2024新年贺词,社会,2023-12-31,央视新闻,298,1,4058404
跨年,其他,2023-12-31,节日君,228,1,4066723
刘宇宁哭了,综艺-内地综艺,2023-12-31,新浪综艺,20,2,1936927
新年快乐,其他,2023-12-31,节日君,11,1,3745086
央视跨年晚会,综艺,2023-12-31,央视文艺,224,3,5996179
甘肃白银4.9级地震,社会,2023-12-31,钱江视频,66,1,12551054
苏翊鸣大方示爱朱易,体育,2023-12-31,网易体育频道,524,1,2945656
富勒姆vs阿森纳,体育,2023-12-31,咪咕足球,36,9,1027600
延时摄影看重庆解放碑跨年现场,社会,2023-12-31,重庆广电-第1眼,73,29,1624664
李国庆宣布离婚成功,财经,2023-12-31,新浪财经,366,1,2177979
被王一博大张伟的合唱戳到,综艺,2023-12-31,湖南卫视跨年晚会,115,13,2300304
鞠婧祎双马尾辣妹,明星-内地,2023-12-31,娱乐圈外汉,251,16,1179554
江苏卫视跨年,综艺,2023-12-31,江苏卫视跨年演唱会,205,1,2795100
李国庆称与俞渝平分1.3亿,社会,2023-12-31,新浪热点,87,18,2411043
祝愿大家福暖四季顺遂安康,时事,2023-12-31,央视新闻,78,30,1623324
情侣坠入冰窟路人源源不断赶来救人,社会,2023-12-31,闪电新闻,39,29,1562424
我的2023全剧终,校园,2023-12-31,微博校园,54,22,1602534
汪涵哭了,综艺,2023-12-31,浪里看综艺,62,18,1335863
京东千万份好礼一分钱,社会,2023-12-31,头条新闻,104,15,2691376
老太买房记孙子名下后发现孙子非亲生,社会,2023-12-31,新浪新闻,219,12,1005757
新能源汽车等给中国制造增添了新亮色,时事,2023-12-31,央视新闻,147,10,2346485
祖国统一是历史必然,时事,2023-12-31,央视新闻,128,5,2894890
湖南卫视跨年节目单,综艺-内地综艺,2023-12-31,湖南卫视跨年晚会,399,1,2633853
2024新年贺词全文,时事,2023-12-31,央视新闻,114,2,2495282
浙江卫视跨年晚会,综艺,2023-12-31,浙江卫视跨年晚会,102,4,2657518
哈尔滨冰雪大世界万人蹦迪,社会,2023-12-31,西部决策,230,2,3713527
江苏卫视跨年节目单,综艺-内地综艺,2023-12-31,江苏卫视跨年演唱会,609,2,1278209
一句话送给2024年的自己,社会,2023-12-31,央视新闻,88,3,2621316
68元锅包肉巴掌大店家转888致歉,社会,2023-12-31,星视频,397,1,1872115
向大家致以新年的祝福,时事,2023-12-31,央视新闻,35,2,3626347
一句话向2023道别,社会,2023-12-31,央视新闻,11,3,3496923
王一博彩排了7次旁观者,明星-内地,2023-12-31,追剧当家人,294,2,1054020
乡村教师靠一条腿撑起2000多个孩子求学路,社会,2023-12-31,大米Video,88,5,2040926
两岸群星共唱明天会更好,音乐-华语音乐,2023-12-31,电影频道融媒体中心,235,3,2899745
挖呀挖黄老师当妈妈啦,社会,2023-12-31,梨视频,390,1,1918367
火箭军成立8周年,军事,2023-12-31,央视军事,46,7,1069878
日本发现大地震海底断层悬崖,社会,2023-12-31,新浪军事,456,1,1901372
2023走在中国的大地上,社会,2023-12-31,新华社,95,3,1250933
肖战工作室包场非诚勿扰3,明星,2023-12-31,娱乐课代表,244,4,1220816
姐弟坠亡案母亲希望死刑尽快执行,社会,2023-12-31,新浪新闻,436,1,1437260
曾黎主持央视跨年,明星-内地,2023-12-31,中新文娱,338,2,1241130
2023手机里最舍不得删的照片,社会,2023-12-31,央视新闻,217,3,1585962
为什么睡觉时会突然抖一下,健康,2023-12-31,央视一套,383,1,1646080
献给2023的告别短片,社会,2023-12-31,人民日报,67,3,1518561
无数个1分钟成就气象万千的中国,社会,2023-12-31,央视新闻,704,3,1248772
一等功喜报到家他和家人却不能露脸,社会,2023-12-30,中国新闻网,284,2,2233831
Cat双位置冠军,游戏,2023-12-30,赛事一手电,141,4,1102394
2024狗屎运最旺的星座,星座,2023-12-30,同道大叔,64,4,1117601
来自光年之外的新年祝福,社会,2023-12-30,新华社,174,3,2247075
张杰一个人pk所有卫视,音乐-华语音乐,2023-12-30,偶像时报,144,2,1060143
央视2024跨年晚会官宣,综艺,2023-12-30,央视文艺,498,1,1328301
为什么我不再沉迷买衣服了,搞笑,2023-12-30,别抢我的汉堡宝,350,2,1095294
AG进入赛点,游戏,2023-12-30,游戏欧皇陈本伟,47,1,1763515
AG对战WB,游戏,2023-12-30,KPL王者荣耀职业联赛,246,1,1414669
央行同意支付宝变更为无实际控制人,财经,2023-12-30,财经网,171,1,2740365
我国卫星互联网技术试验卫星发射成功,社会,2023-12-30,央视新闻,254,3,2167022
阿根廷正式拒绝加入金砖国家,社会,2023-12-30,新浪军事,95,4,1133676
如果文物们来一场新年音乐会,社会,2023-12-30,央视新闻,58,3,1051043
踏上2024新征程,综艺-内地综艺,2023-12-30,北京卫视跨年之夜,23,3,1066474
告别2023写给自己的话,社会,2023-12-30,央视新闻,271,3,1026203
何蓝逗有呼吸性碱中毒,综艺-内地综艺,2023-12-30,松鼠娱评,438,1,1138763
俄女网红办半裸派对引普京不满,社会,2023-12-30,大象文娱,487,1,1517759
央视前名嘴段暄行贿逾950万元,社会,2023-12-30,新浪热点,132,2,1138865
我在2元店都不敢这么买,搞笑,2023-12-30,五行属二,801,1,1359586
人民日报评禁放烟花,社会,2023-12-30,大河报,319,2,1451443
2023这些凡人微光照亮前路,社会,2023-12-30,新华社,770,3,1421050
陌生人发来的晚安,社会,2023-12-29,新世相,126,1,1445147
董军任国防部部长,社会,2023-12-29,北京青年报,300,1,1906185
中医不相信张远38岁了,综艺,2023-12-29,浪里看综艺,395,2,1327025
宋佳演的张桂梅校长,电视剧,2023-12-29,浪里追剧,151,1,1026465
阿里被判赔京东10亿,财经,2023-12-29,梨视频,389,1,2484411
元旦假期全国大部天气晴好适宜出行,社会,2023-12-29,央视网,28,3,1046276
李善均出殡现场全慧珍痛哭,明星,2023-12-29,新浪娱乐,390,2,1212115
2023中国航天书写傲人答卷,社会,2023-12-29,央视网,47,3,1089290
雪龙号抵达长城站,社会,2023-12-29,人民日报,311,3,1907566
女子因思念亡父泪崩被6岁女儿治愈,社会,2023-12-29,重庆广电-第1眼,263,2,1931922
BLACKPINK个人不与YG续约,明星-日韩,2023-12-29,爱豆上班啦,504,1,1355585
孟羽童发声,社会,2023-12-29,梨视频,657,1,2803106
刘强东京东内网发声,财经,2023-12-29,梨视频,38,2,1026363
招商银行向员工逆向讨薪近6000万,社会,2023-12-29,新浪热点,359,2,1137946
张钰琪毕业回国,音乐,2023-12-29,张钰琪官方后援会,387,1,1841274
一家8口住酒店称很划算准备住一辈子,社会,2023-12-29,新浪热点,494,1,1795916
顾客摸草莓不买遭商家泼水,社会,2023-12-29,头条新闻,350,2,1175253
2023那些被瞬间治愈的时刻,社会,2023-12-29,央视新闻,443,3,1452270
iPhone遭遇史上最复杂攻击,互联网,2023-12-29,科技猩球,408,4,1245874
女子离职后把手机静音1年,社会,2023-12-29,新浪新闻,876,1,1441125
82岁院士自曝每天熬夜到2点,社会,2023-12-29,大米Video,296,4,1091771
上海宝格丽酒店跨年夜房费高达30余万,社会,2023-12-29,大众网,281,2,1575418
雷军致敬车企仅华为未回应,互联网,2023-12-29,新浪科技,292,1,1067148
跟着AI重走2023中国科技之旅,社会,2023-12-29,新华社,653,3,1560077
捐献者15年不换手机号成功救人一命,社会,2023-12-28,中国之声,321,2,2183166
姜涛全球最帅面孔第三,明星-港台,2023-12-28,聪明勇敢小阿雷l,420,2,1747590
向太宣布将出售耗时十年建成豪宅,社会,2023-12-28,西部决策,305,2,1969598
康康都一米八了,明星-内地,2023-12-28,橘子娱乐,359,4,1453208
周冬雨金莲花影后,明星,2023-12-28,新浪大文娱,175,4,1255476
刘亦菲金莲花视后,明星-内地,2023-12-28,娱乐小浪花er,168,2,1401029
25至29岁年龄段未婚率超50%,社会,2023-12-28,新浪新闻,156,2,1338398
小米汽车价格,财经,2023-12-28,老板联播,555,1,8814069
2023这些温暖开心的瞬间,社会,2023-12-28,新华网,110,3,1832244
李善均身亡前疑似最后监控曝光,社会,2023-12-28,世面,453,1,1432454
第二届链博会展期确定,社会,2023-12-28,中国新闻网,238,3,2026650
退休前最后一课黑板依然满是板书,社会,2023-12-28,人民网,64,5,1542697
1只边牧被救咕噜咕噜变3只,社会,2023-12-28,农民频道,419,5,1582774
北京西站民警的这个妙招应周知所有旅客,社会,2023-12-28,北京公交警方,36,7,1259508
老师把婚礼办到了幼儿园里,社会,2023-12-28,中国新闻网,568,7,1048483
搜救犬肥肥和战友们回家啦,社会,2023-12-28,济南时报,17,7,1177235
上海杀妻欲藏尸冰柜案二审维持死刑,社会,2023-12-28,头条新闻,300,2,1227369
2023全球最帅最美面孔,音乐,2023-12-28,钮祜禄流流,215,2,1181318
卷生卷死的韩国人开始逃了,社会,2023-12-28,新浪新闻,440,1,1969259
王一博加入朵拉头宇宙,音乐,2023-12-28,剧星速报,133,4,1045214
2023那些对于热爱的回答,社会,2023-12-28,人民日报,190,3,2171795
威胁李善均女室长抱孩子出席庭审,明星-日韩,2023-12-28,爱豆上班啦,184,4,1143701
儿子诈骗30万母亲只愿退赔9000,社会,2023-12-28,时间视频,295,2,1139991
韩媒曝李善均遗书内容,明星,2023-12-28,新浪大文娱,387,4,1130502
一起见证2023逐梦九天感人瞬间,社会,2023-12-28,新华社,10,3,1105703
2023中国航天高燃时刻,社会,2023-12-28,新华网,742,3,1560658
小白80万上海开面馆6天濒临倒闭,社会,2023-12-28,西部决策,320,2,1072165
新生儿遭月子中心月嫂虐待,社会,2023-12-28,百姓关注,376,2,1358466
全面禁放烟花爆竹是时候终结了,社会,2023-12-28,顶端新闻,773,1,1862884
女孩头发长虱子老师趁晴天帮其洗头,社会,2023-12-27,都市时报,390,5,1120867
韩国娱乐圈因李善均去世暂停活动,明星,2023-12-27,凤凰网娱乐,376,4,1008515
淘宝将支持仅退款,互联网,2023-12-27,界面新闻,679,1,3956060
繁花开播,电视剧-国产剧,2023-12-27,浪里追剧,271,4,1127164
周海媚为突发心脏病猝死,社会,2023-12-27,新浪新闻,306,1,2790331
3块钱的饮料正在集体消失,互联网,2023-12-27,网易数读,153,2,1260191
这条高铁沿途串起9个5A景区,社会,2023-12-27,央视新闻,126,3,1192702
我国八纵八横高铁网建成约80%,社会,2023-12-27,央视网,385,3,1425067
复旦教授称中国退休年龄还是太早,互联网,2023-12-27,电商在线,384,4,1358321
花卷哭了,游戏,2023-12-27,王者荣耀李小白君,122,4,1020103
妈妈去世3年手机收到爱的童言,社会,2023-12-27,农民频道,463,5,1032994
李善均去世,明星-日韩,2023-12-27,爱豆上班啦,522,1,9222825
李善均疑似被夜店公关等勒索3.5亿韩元,明星,2023-12-27,红星新闻,302,1,2725709
全面禁燃烟花爆竹不合法,财经,2023-12-27,新浪财经,254,2,1111059
重温2023中国健儿高燃瞬间,体育,2023-12-27,新华社,34,3,1331057
盘点2023我国重大科技成就,社会,2023-12-27,人民日报,278,3,2039584
欠4600万在杭卖烤肠还债的大叔回家了,社会,2023-12-27,钱江晚报,240,1,2054681
房东举报诡异绿光获重大奖励,社会,2023-12-27,中国新闻网,417,1,2846160
穷鬼套餐不涨价,社会,2023-12-27,梨视频,304,4,1116279
胡歌对接否认资助女孩成了中科院博士,明星,2023-12-27,娱乐有饭,299,2,1132290
2023你被哪些瞬间治愈,社会,2023-12-27,新华网,39,3,1363599
卫健委否认医护集体跳楼,社会,2023-12-27,新浪新闻,241,2,1011489
三条高铁今日开通,社会,2023-12-27,人民日报,666,3,1880207
我国北斗系统性能再次提升,社会,2023-12-27,央视新闻,7,3,1076568
麦当劳明起涨价,财经,2023-12-26,澎湃新闻,537,1,2774567
2024央视春晚彩排,综艺,2023-12-26,狐厂大拷问,357,2,1382038
香港演员黎淑贤去世,社会,2023-12-26,成都商报,152,2,1233714
羽生结弦前妻首度发声,明星-内地,2023-12-26,会火全娱乐,299,1,3003769
央视揭朋友圈少儿才艺投票骗局,社会,2023-12-26,央视新闻,140,2,1028311
3岁娃介绍家庭成员唯独忘了警察爸爸,社会,2023-12-26,新华网,251,2,2826147
金莎因为孙丞潇戴初恋送的项链哭了,综艺,2023-12-26,新浪综艺,468,1,1586020
2023中国时刻,社会,2023-12-26,中国新闻网,245,3,2786147
网红狐狸死在雪地里,社会,2023-12-26,农民频道,566,1,3185533
消防员冲进火场一把抱起小孩就跑,公益,2023-12-26,中国消防,144,5,2058958
男子突发低血糖酒店员工暖心相助,社会,2023-12-26,农民频道,137,5,1305333
官方回应加鹅羽绒服疑被挂闲鱼倒卖,社会,2023-12-26,冷暖视频,350,2,1140918
陶勇回应近期网络风波,社会,2023-12-26,九派新闻,428,1,2168898
甘肃震区已有序复商复市复课,社会,2023-12-26,小央视频,66,3,1133430
盘点2023大国重器新突破,社会,2023-12-26,人民日报,283,3,1505673
孩子有超雄综合征就是天生坏种吗,社会,2023-12-26,头条新闻,381,1,1761100
重庆一疑似智障女子与五旬男子结婚,社会,2023-12-26,头条新闻,345,2,1223253
张杰谢娜跳单案中介公司注销,明星,2023-12-26,白鹿视频,268,1,1250226
毛主席诞辰130周年,社会,2023-12-26,人民日报,442,1,1155482
去有风的地方获200万元补助,电视剧-国产剧,2023-12-26,刘亦菲FM825,367,1,1151817
网信办处置一批仿冒企业诈骗网站,社会,2023-12-26,新华网,177,3,1105554
网易暴雪复合,互联网,2023-12-26,新浪科技,704,1,1271302
我国月收入2000元以下人口约9.64亿,社会,2023-12-26,第一财经日报,66,1,3837371
终于知道工资为什么要保密了,社会,2023-12-25,猛犸新闻,674,1,2967497
优酷确认获得知否独播权,电视剧,2023-12-25,红星新文娱,311,2,1112576
李永钦摔下升降台,明星,2023-12-25,新浪大文娱,166,1,1800458
订婚强奸案后女方家属想尽快结婚,社会,2023-12-25,西部决策,140,2,1432601
女子遭未婚夫强奸曾逃出房呼救被拖回,社会,2023-12-25,法治日报,150,1,2858126
新批准国产网游版号达105款,社会,2023-12-25,央视新闻,823,3,2191574
调查称读研平均最低月薪13218元,财经,2023-12-25,中新经纬,373,4,1103428
张艺兴入职中国国家话剧院,明星-内地,2023-12-25,青流娱乐,302,1,2453381
郑爽被法院公告,明星,2023-12-25,点时新闻,341,1,2355923
男子订婚后被告强奸一审被判3年,社会,2023-12-25,新浪新闻,471,1,2945342
女孩给陌生猫咪送暖宝宝取暖,社会,2023-12-25,中国蓝新闻,132,5,1490115
挖呀挖桃子老师每场直播收入仅千元,社会,2023-12-25,西部决策,232,1,2771044
女研究生制售色情书被抓,社会,2023-12-25,头条新闻,589,4,1508938
迪丽热巴双生神女,时尚,2023-12-25,新悦文娱,313,2,1396006
同居生2孩7年后男方诉返还彩礼,社会,2023-12-25,九派新闻,334,2,1206448
黄子韬cue徐艺洋发言,明星,2023-12-25,重头戏,297,5,1379245
男子供养女友及其丈夫一家5年,社会,2023-12-25,南方都市报,276,2,1154753
2024元旦放假安排来了,社会,2023-12-25,中国新闻网,356,1,3075014
如果不是地震没人知道我们有多穷,社会,2023-12-25,新浪新闻,111,2,1538361
上班睡觉被辞退能拿到赔偿吗,搞笑,2023-12-25,镜花水月雾中你,305,2,1302247
我国成功发射一箭四星,社会,2023-12-25,央视新闻,93,3,1007211
甘肃震区中小学有序复课,社会,2023-12-25,央视新闻,38,3,1040294
教育局通报小学教师殴打学生致脑震荡,校园,2023-12-25,澎湃新闻,262,1,1422255
国产首艘大型邮轮离港首次试运营,社会,2023-12-25,新华网,248,3,1349173
美国黄石公园检测出僵尸鹿病毒,社会,2023-12-25,新浪军事,640,1,1334542
上海迪士尼发布通知,社会,2023-12-25,红星新闻,630,1,1479975
考研结束,教育,2023-12-24,新浪考研,428,1,3711375
15岁孙子重度抑郁爷奶掏所有钱帮治,社会,2023-12-24,白鹿视频,338,1,1427843
赵露思cos英雄联盟格温,明星,2023-12-24,吃瓜手册,294,4,1266529
男子仅有10万元买下191万的房子后悔,社会,2023-12-24,星视频,304,1,1999639
主持人大赛冠军,综艺,2023-12-24,宇宙娱乐派,123,2,1135659
这些科技硬实力彰显中国底气,社会,2023-12-24,新华网,155,3,1409721
硬核国之重器彰显中国实力,社会,2023-12-24,央视新闻,145,3,1538459
男孩患白血病妈妈面对意外钱财拾金不昧,社会,2023-12-24,新华网,248,2,2526108
中国蓝盔正式结束10年维和使命,社会,2023-12-24,人民网,169,2,2442589
高考和考研结束走出考场的心情图鉴,校园,2023-12-24,梧桐Video,126,5,1196927
民警冰面匍匐30米救出落水女子,社会,2023-12-24,新华社,21,7,1003019
朱令讣告,社会,2023-12-24,半岛都市报,359,1,2956310
考研数学,科普,2023-12-24,海离薇,488,1,5448887
在声音中回首一起走过的2023,社会,2023-12-24,新华网,247,3,2384312
还是孩子的哥哥为妹妹撑起一片天,社会,2023-12-24,重庆广电-第1眼,50,6,1019822
中国女子在日本滑雪被雪掩埋不幸去世,社会,2023-12-24,新浪新闻,311,2,1019356
不管多晚我们都会让每个帐篷有盏亮灯,社会,2023-12-24,央视新闻,271,3,2859868
曾参与朱令铊中毒抢救诊治医生发声,社会,2023-12-24,白鹿视频,100,6,1183951
遇见2023的中国,社会,2023-12-24,新华社,54,3,1145154
三个退出考研的人讲述为何而退,社会,2023-12-24,齐鲁晚报,610,1,1070368
朱令父亲发声,社会,2023-12-23,新浪新闻,685,2,2192393
花少5压中考研政治题,综艺-内地综艺,2023-12-23,柠檬初恋日记,308,5,1290982
Jennie成立个人厂牌,明星,2023-12-23,有娱追剧,199,4,1273660
钟南山称不主张长期佩戴口罩,社会,2023-12-23,中国新闻周刊,99,1,1177771
朱令去世,社会,2023-12-23,新民周刊,770,1,12304558
甜馨拍杂志了,明星,2023-12-23,猹的追星日记,415,2,1196993
肖战直播,明星-内地,2023-12-23,星姐微博,91,4,1537543
浙大学霸用一页纸证明自己,社会,2023-12-23,浙江日报,301,2,3305700
卫星视角看中国,社会,2023-12-23,新华社,10,3,1080687
共赏改革开放新画卷,艺术-绘画,2023-12-23,人民网,161,3,3338549
救援队吃饭付钱被面馆老板霸气拒收,社会,2023-12-23,梨视频,47,5,1340211
考点为脑瘫学生安排了一个特殊考场,社会,2023-12-23,梨视频,70,5,1669316
天黑了帐篷没到震区34岁的他急哭,社会,2023-12-23,央视新闻,144,5,2019086
金靖爆改韩系美女,明星-内地,2023-12-23,治愈,534,4,1051733
奶爸袋鼠式带娃坐地铁,社会,2023-12-23,新华网,51,10,1662005
国家新闻出版署回应网游管理办法草案,社会,2023-12-23,央视新闻,106,13,1009466
男子嫌假证办得太假报警,公益,2023-12-23,十堰市公安局东岳分局,127,7,2249848
乘风破浪一往直前,社会,2023-12-23,新华网,142,3,3863040
父亲称朱令2次铊中毒活到现在是奇迹,社会,2023-12-23,南风窗,260,2,1269911
别克E5,汽车,2023-12-23,电动扒士,74,11,1159249
听见2023的中国,社会,2023-12-23,新华社,341,3,5889707
被老鼠咬后反咬女子室友发声,社会,2023-12-23,九派新闻,774,1,1225343
联合国通过决议将春节作为联合国假日,时事,2023-12-23,环球网,156,2,1321458
腾讯市值跌没了一个小米,财经,2023-12-23,中国新闻网,148,2,1025831
韩国人在首尔买房须不吃不喝15.2年,社会,2023-12-22,新浪新闻,445,1,2456727
刘芸走红毯贴了70个暖宝宝,明星,2023-12-22,浪里看娱,485,1,1839139
地震已致148人死亡,社会,2023-12-22,新华社,381,4,1188025
TODS致歉,明星,2023-12-22,吃瓜手册,244,2,1350182
2023年国际舞台上的中国风,社会,2023-12-22,新华社,113,3,1594666
明天考研我们一研为定,社会,2023-12-22,西部决策,321,2,1818266
神十七航天员圆满完成首次出舱任务,社会,2023-12-22,央视新闻,11,3,1478573
见证灾后安置的中国速度,社会,2023-12-22,新华网,73,3,1657824
朱丹回应主持叫错名字,明星-内地,2023-12-22,娱乐十二点,270,1,1322019
种地吧,综艺,2023-12-22,种地吧,232,2,1520398
2023这是我们的回答,社会,2023-12-22,人民日报,282,3,1372275
震区男孩把小猫藏帽子里取暖,社会,2023-12-22,央视新闻,337,5,1181589
演员于洋回应家中存放大量金砖,明星-内地,2023-12-22,大象文娱,324,1,1990534
游戏,游戏,2023-12-22,新浪游戏,361,4,1275146
杨丽萍团队跳科目三,明星,2023-12-22,娱乐课代表,345,4,1001582
北大天才柳智宇还俗后宣布结婚,社会,2023-12-22,点时新闻,246,4,1252017
仰起头看见2023的中国,社会,2023-12-22,新华社,22,3,1065223
冬至愿美好如约而至,社会,2023-12-22,新华网,273,3,1901546
范迪塞尔被控性侵,明星-欧美,2023-12-22,守望好莱坞,385,1,1519098
虞书欣林一演情侣,电视剧,2023-12-22,前线时报,287,2,1040688
冬至,社会,2023-12-22,节日君,895,1,1253106
赵露思替身发文,明星-内地,2023-12-22,娱超人,875,1,1233937
电商收到退货穿黑磨损的雪地靴,社会,2023-12-22,爱上长春事儿,324,1,2060594
你的肩膀我的依靠,社会,2023-12-22,新华社,744,3,1207083
涉事医生回应手术时捶压老人头部,社会,2023-12-22,紧急呼叫,509,1,1980258
推进乡村全面振兴,时事,2023-12-22,经济日报,9,3,1122736
男主播直播喝白酒时死亡,社会,2023-12-21,手机上的新浪,591,1,2563798
戒毒男子得知女儿离世后回家告别,社会,2023-12-21,点时新闻,293,2,1366874
男子被判奸杀姐妹入狱21年获无罪,社会,2023-12-21,九派新闻,384,4,1474732
周杰伦新歌上线,音乐,2023-12-21,新浪音乐,178,1,2327372
2023内娱TOP1,明星,2023-12-21,新浪大文娱,337,4,1167817
有人从中国乘飞机往韩国背大米,社会,2023-12-21,新浪新闻,333,2,1297933
微博年度报告,社会,2023-12-21,新浪安徽,392,1,1812094
狗狗走失流泪绝食网友合力找主人,社会,2023-12-21,都市时报,187,2,1475325
两学生奔向刺骨海水救回母子二人,社会,2023-12-21,新华网,206,5,1298014
探访极寒天气下保供保畅黑科技,社会,2023-12-21,新华社,291,3,1475305
训导员提到搜救犬说挺为它骄傲,社会,2023-12-21,央视新闻,96,2,1476057
我们一起渡难关,社会,2023-12-21,新华网,77,3,1246912
医生不建议年轻人没问题就推拿,社会,2023-12-21,中国新闻网,524,1,1931514
共话北京数字经济发展新蓝图,财经-宏观经济,2023-12-21,中宏网,90,3,1092243
中止对台湾地区部分产品关税减让,社会,2023-12-21,央视新闻,215,1,1053579
甘肃积石山县4.1级地震,社会,2023-12-21,新京报,416,1,1926689
甘肃地震已致135人遇难,社会,2023-12-21,央视新闻,299,1,1542001
2024年三农工作,时事,2023-12-21,央视新闻,630,3,1216655
冻到皮肤发红就要警惕了,社会,2023-12-21,人民日报,594,1,1117913
甘肃积石山地震致134人遇难,社会,2023-12-20,央视新闻,237,1,1235992
小杨哥回应每月发5000万工资,互联网,2023-12-20,财经网科技,502,1,2411059
小杨哥称曾拒绝2800万玩三场游戏,财经,2023-12-20,梨视频,449,2,1647957
地震已致131人遇难,社会,2023-12-20,北京日报,393,1,1377665
甘肃震区煮不完的饺子和不灭的车灯,社会,2023-12-20,大众网,457,1,2191388
许佳玲遇害前一天刚与男友拍完婚纱照,明星-其他,2023-12-20,红星新闻,215,2,1077423
A股大跌,财经,2023-12-20,中国新闻网,99,4,1107204
14亿多同胞是你们的坚强后盾,社会,2023-12-20,新华社,215,3,1292200
泰国瑞幸向中国瑞幸索赔100亿泰铢,社会,2023-12-20,新浪热点,891,2,1244414
甘肃加油青海加油,社会,2023-12-20,新华社,764,3,1430625
唐山一殡仪馆分高低档炉火化引质疑,社会,2023-12-20,后浪视频,86,4,1000842
特朗普被裁决不具备总统选举资格,社会,2023-12-20,贝壳财经,260,2,1352446
地震已致127人遇难,社会,2023-12-20,新华社,645,1,1160876
哈尔滨冰雪大世界致歉,社会,2023-12-19,西部决策,443,4,1275213
鸿星尔克直播间回应捐款,社会,2023-12-19,西部决策,296,2,3670085
焦恩俊夸了于十三,电视剧-国产剧,2023-12-19,圈内少年,396,6,1094829
鸿星尔克又捐了2000万,体育,2023-12-19,新浪NBA,615,1,2189311
青海一孕妇回娘家途中失联,社会,2023-12-19,头条新闻,123,2,1002982
向地震灾区下达2.5亿元中央预算内投资,社会,2023-12-19,央视新闻,199,3,1257011
青海省委书记抱着安慰痛哭的灾民,社会,2023-12-19,新浪新闻,255,1,1988627
新疆地震,社会,2023-12-19,央视新闻,726,2,4485361
韩国仁川刺激生育每个婴儿补贴55万,社会,2023-12-19,观察者网,271,1,2040360
用户称地震时7部苹果手机均无预警,生活记录,2023-12-19,白鹿视频,367,1,2216335
确保震区考生顺利参加考研,社会,2023-12-19,央视新闻,220,2,1173061
儿童呼吸道感染居家照护指南,社会,2023-12-19,央视网,244,3,2589933
甘肃地震受灾群众吃上热牛肉面,社会,2023-12-19,央视新闻,204,5,1283248
广州下雪,社会,2023-12-19,新浪广东,86,1,2354351
甘肃地震已致126人遇难,社会,2023-12-19,央视新闻,140,1,8221431
江平去世,社会,2023-12-19,北京头条,369,1,2831380
