title,label,time,host,continue,sort,hot
东部战区位台岛周边海空联合演训,社会,2023-08-20,人民日报,778,3,1931699
台岛周边我舰抵近台舰,时事,2023-08-20,环球时报,323,6,1013154
痞幼追星Angelababy,明星,2023-08-20,張贰缑,103,2,1280125
魏大勋泼李雪琴一杯水后在角落里自罚一杯,综艺-内地综艺,2023-08-20,新报文娱,512,1,1876315
周冬雨刘昊然隔得好远,明星,2023-08-20,剧综种草机,479,1,2195728
电影消失的她,电影,2023-08-20,电影消失的她,428,2,1583816
长相思第二季的防风邶剧照,电视剧-国产剧,2023-08-19,宇宙文娱派,295,1,1598702
玲花不喜欢别人叫她全名的原因,综艺-内地综艺,2023-08-19,看文娱,325,4,1748759
杨紫好忙但不知道在忙什么,综艺,2023-08-19,看点热剧,189,2,1434413
魏大勋赵今麦版鬼怪,明星,2023-08-19,白鹭视频,250,1,1993021
王鹤棣音乐节,明星,2023-08-19,奇异文娱,61,5,1096825
800多赞的朋友圈长什么样,社会,2023-08-19,人民日报,142,1,2041159
吉林女生体制内离职打零工创业,社会,2023-08-19,云景视频,80,4,1229821
你好星期六下周是莲花楼,综艺,2023-08-19,剧星冲浪板,110,2,1210780
久哲卸任Hero主教练,游戏,2023-08-19,游戏吐槽酱,209,1,2493942
娃哈哈董事长女儿评论区,社会,2023-08-19,探长文娱,183,1,1487266
Ella说山支回来了,综艺-内地综艺,2023-08-19,泡椒娱,224,2,1313494
今天第6个中国医师节,社会,2023-08-19,人民日报,319,3,1789524
四川地震,社会,2023-08-19,人民日报,370,1,4285049
质疑左立理解左立成为左立,综艺-内地综艺,2023-08-19,追剧放大镜,139,4,1081326
他拿了1瓶水放回来8提水,社会,2023-08-19,人民网,327,5,1303339
爸爸4年暑假接送26岁女儿上下班,社会,2023-08-19,西部决策,296,2,2020636
祝所有平凡而伟大的医生节日快乐,社会,2023-08-19,新华社,11,3,1141148
谢谢你生命的守护者,社会,2023-08-19,央视新闻,292,3,1808526
浙江一学校的军训是集体摸鱼,社会,2023-08-19,钱江视频,269,2,1083710
上海六院称已连夜处理窗口人员阴阳怪气事件,社会,2023-08-19,看看新闻KNEWS,397,1,2347443
知情人曝李玟摔倒后节目组没喊停,明星-港台,2023-08-19,凤凰网娱乐,559,1,2610347
杨紫张晚意情侣装,综艺,2023-08-19,星剧狂人,359,4,1106434
内江4.2级地震,社会,2023-08-19,央视新闻,80,2,1124365
央广网评长安三万里被批不符史实误导观众,社会,2023-08-19,央广网,417,1,1532629
竟然从一个摄影镜头里看到了慌张,明星-内地,2023-08-19,资深热心观众,448,2,1100135
长相思导演回应官配为什么不是男主,电视剧-国产剧,2023-08-19,剧综说,283,1,1404662
中国好声音商标被判无效,社会,2023-08-19,中新经纬,396,4,1056128
长相思剧组好六最强售后,综艺,2023-08-19,湖南卫视你好星期六,180,1,1279758
中国基建太牛了,社会,2023-08-19,新华社,79,3,1112178
薛佳凝晒与赵露思合照,明星-内地,2023-08-19,会火全娱乐,193,4,1257812
妻子欲当网红改善生活遭丈夫反对并砸家,社会,2023-08-19,观察者网,53,5,1096104
周琦赵睿互换东家,体育,2023-08-19,球圈赵探长,654,2,1401271
中国国家太空实验室已正式运行,军事,2023-08-19,央视军事,686,3,1258264
外国老友对黄晓明说因为你让我认识中国,综艺-内地综艺,2023-08-19,稞清视频,166,1,1242648
中国好声音赞助商遭网友喊话,财经,2023-08-19,中新经纬,616,1,2078106
好声音寥寥数行回应就是对逝者的尊重吗,综艺,2023-08-18,红星新闻,252,4,1483753
李玟姐姐称网传视频属实,明星-港台,2023-08-18,凤凰网娱乐,423,1,2689435
卿卿日常紫薯精vs七时吉祥走地鸡,电视剧-国产剧,2023-08-18,追剧放大镜,118,2,1042342
中泰缅老警方合作打击赌诈集团,社会,2023-08-18,央视新闻,140,2,1314197
医院回应穿刺失误致女童死亡,社会,2023-08-18,央广网,227,1,2313673
杨颖不忍心拒绝小朋友合照要求的原因,明星,2023-08-18,爱看星综艺,82,4,1154792
何炅是半个娱乐圈的伯乐,明星-内地,2023-08-18,新剧匣子,170,4,1527834
杨坤不止一次吐槽过好声音,明星,2023-08-18,剧综班主任,96,1,2068087
古天乐毁容妆过敏,电影,2023-08-18,看文娱,273,1,1303388
陆毅因为贝儿参加披荆斩棘,综艺,2023-08-18,宇宙娱乐派,317,1,1973718
上半年我国服务贸易总体平稳增长,社会,2023-08-18,央视网,114,3,1926454
中国好声音母公司股价大跌,财经,2023-08-18,新浪港股,489,1,3754310
缅甸华人称缅甸确实被妖魔化,社会,2023-08-18,新浪热点,681,1,3046390
李佳琦到底多大了啊,明星-内地,2023-08-18,饭圈暖男刘潇洒,223,2,1264818
爸爸车祸后7岁小哭包变成顶梁柱,社会,2023-08-18,央视新闻,519,2,1225841
菜摊边写作业的女孩被川大华西口腔录取,政务,2023-08-18,成都发布,166,2,1553264
李嘉捷向好声音致歉,综艺-内地综艺,2023-08-18,晚抱文艺,532,1,9787497
国家科技创新力的根本源泉在于人,社会,2023-08-18,央广网,20,3,1408752
六公主播宝莲灯怀念李玟,电影-华语电影,2023-08-18,淘票票,345,2,1597183
中国式现代化的京津冀实践,社会,2023-08-18,中国经济网,298,3,1782260
男子阳台吸烟跌到通风井多处摔伤,公益,2023-08-18,中国消防,91,5,1179292
林志颖公开回应车祸经历,综艺,2023-08-18,松鼠娱评,231,1,1122155
中国好声音声明,综艺,2023-08-18,中国好声音,1086,1,8423312
缅北受访者称噶腰子仅是段子,社会,2023-08-18,中新经纬,397,1,2042022
于正张檬再次合作,电视剧-国产剧,2023-08-18,娱乐星事,282,2,1162687
杨洋告黑案将开庭,明星-内地,2023-08-18,财经网,344,2,1228451
电影孤注一掷被指侵权,财经,2023-08-18,新浪财经,409,1,2322991
王一栩再发长文,电视剧-国产剧,2023-08-18,搜狐娱乐,298,2,1261877
弟弟为救在缅甸哥哥又被骗电诈园区,社会,2023-08-18,红星新闻,364,1,1886603
是中国建造更是中国设计,社会,2023-08-18,人民网,244,3,1536543
武大回应夫妻宿舍配有两张单人床,社会,2023-08-18,头条新闻,285,2,1122447
恒大在美国申请破产保护,财经,2023-08-18,凤凰网财经,279,1,1439327
衡水中学校长称已注意到网红要打衡中,社会,2023-08-18,中国网直播,704,1,1763141
这些灾后恢复的画面辛苦又感动,社会,2023-08-18,央视军事,655,3,1599237
我不是药神白血病少年扮演者入院捐髓,社会,2023-08-18,SBS暖视频,249,1,1149081
女子凌晨被短信告知航班提前3.5小时起飞,社会,2023-08-18,021视频,588,1,1082157
考上研究生才敢说的大实话,校园,2023-08-17,参喜喜,373,1,2147505
马伯骞回复赵露思芋泥香酥鸭管够,综艺,2023-08-17,音乐盒子_BoX,317,2,1209049
李玟生前控诉中国好声音录音曝光,综艺-内地综艺,2023-08-17,搜狐娱乐,154,1,13253033
中科院博士被骗至缅甸一年,社会,2023-08-17,九派新闻,356,1,3790964
古天乐新片骂了33秒脏话,电影-华语电影,2023-08-17,破晓视频,104,1,2140758
丫丫又圆润啦,社会,2023-08-17,新华网,349,5,1529784
陈立农diss宝石老舅,综艺-内地综艺,2023-08-17,芒果饭时尚,483,4,1105078
2元炒菜哥称给我千千万也不在乎,社会,2023-08-17,齐鲁电视台,153,2,2682506
丫丫咬着竹子上爬架继续啃,社会,2023-08-17,新华社,236,1,2636678
曝七时吉祥抄袭秦时明月,电视剧,2023-08-17,巨火视频,333,1,1572279
张文宏被造谣妻子是医药代表,社会,2023-08-17,第一财经日报,221,1,1105861
老头乐刮蹭450万法拉利被索赔190元,社会,2023-08-17,点时新闻,364,2,1140837
12306回应母亲带病儿买三张票,社会,2023-08-17,时间视频,294,1,1306568
原来焯水不是简单煮一下,社会,2023-08-17,生命时报,464,1,1471591
披荆斩棘3全阵容官宣,综艺,2023-08-17,披荆斩棘,286,1,1996590
3条高铁新线即将开通,社会,2023-08-17,人民日报,231,3,1106112
林志颖参加披荆斩棘的原因,综艺,2023-08-17,向上娱乐,296,4,1052574
Lisa上了ins富豪榜,明星-日韩,2023-08-17,清流娱乐网,364,4,1259224
北海一浴场突发不明鱼类伤人事件,社会,2023-08-17,沸点视频,437,1,2418751
女子买3个座位被无座大爷骂哭,社会,2023-08-17,新浪新闻,194,5,1009163
长安三万里致歉声明,电影-华语电影,2023-08-17,娱乐小浪花er,754,1,1913284
亚运会游泳跳水田径门票今起实时销售,社会,2023-08-17,人民日报,741,3,1305336
王传君不想女儿以为他是坏人,电影,2023-08-17,新浪电影,705,1,1511399
广西北海,社会,2023-08-17,中国新闻网,136,4,1009265
没想到家有儿女里也有海底捞,电视剧,2023-08-16,剧综种草机,176,1,1959118
长相思第二季能不能明天播啊,电视剧-国产剧,2023-08-16,鞭子娱乐,226,1,1542592
在鸭血上发现的红唇,搞笑,2023-08-16,成都摆烂青年,145,1,1435226
被严重低估的两部古装剧,电视剧,2023-08-16,剧综种草机,231,4,1083898
奶奶接法国来电10岁乖孙帮转账,社会,2023-08-16,中国长安网,66,2,1041685
初秋的乡间田野生机勃勃,社会,2023-08-16,央视新闻,113,3,1140767
丁禹兮把赵露思的黄豆糕喂给杨超越,电视剧-国产剧,2023-08-16,7101024565_350,217,1,1746746
洪灾后不同场所消毒要点,社会,2023-08-16,央视网,346,3,1389046
警方正调查女大学生疑被贩卖,社会,2023-08-16,中国新闻周刊,419,2,1097084
姑姑回应11岁女孩农村土房前自信跳舞,社会,2023-08-16,大米Video,273,2,1435687
BLACKPINK官宣首尔演唱会,明星-日韩,2023-08-16,搜狐韩娱,282,1,1460140
杨幂说是周笔畅唯一的朋友,综艺,2023-08-16,综艺日记,202,2,1316095
披荆斩棘第三季官宣,综艺,2023-08-16,披荆斩棘,514,1,2583823
多家公司吐槽logo变成视觉中国版权图,财经,2023-08-16,凤凰网财经,401,1,1530126
22岁女大学生疑被贩卖缅北,社会,2023-08-16,中国新闻周刊,189,1,2414812
孙俪好薄,电视剧,2023-08-16,剧荒主义,357,4,1391787
黄晓明3分钟讲了392个字一条过,电影,2023-08-16,新浪电影,322,2,1732400
原来真正殉情的是相柳,电视剧,2023-08-16,哇哦文艺,210,1,1608047
在缅中企工作人员称不要妖魔化缅甸,社会,2023-08-16,新浪热点,462,2,1646825
30秒看308米长江大桥主塔拔地而起,社会,2023-08-16,新华社,84,3,1203578
缅甸失联20岁男生已找到父亲发声,社会,2023-08-16,红星新闻,410,4,1078413
央视曾称视觉中国为知识产权市场的毒瘤,互联网,2023-08-16,新浪科技,237,2,1724626
汪苏泷说抢不到票这事怪我,综艺-内地综艺,2023-08-16,流年视频,150,2,1012644
中国国家天文吐槽视觉中国,互联网,2023-08-16,财经网科技,195,2,1025626
自己拍的照片被视觉中国告侵权,互联网,2023-08-16,凤凰网科技,711,1,1267485
于适有商务了,明星,2023-08-16,青稚视频,52,4,1307212
女子称带3娃买4张票登机被拒,社会,2023-08-16,白鹿视频,516,2,1080901
哈登震惊于中国卖货速度,体育,2023-08-16,咪咕篮球,397,1,1402449
印度不再从中国进口手机,社会,2023-08-16,第一财经日报,138,2,2484971
海底捞可以洗头发了,搞笑,2023-08-16,北半球,146,1,2954979
绿色出游守护祖国大好河山,社会,2023-08-16,新华社,646,3,1873919
北京为何成了茶饮荒漠,社会,2023-08-16,青年说,232,4,1121945
rapper冶人为TangoZ发声,明星,2023-08-16,星火,86,1,2632332
画中画看长江沿线非遗,社会,2023-08-16,新华社,28,3,1516400
日媒曝福原爱或将面临国际通缉,明星-日韩,2023-08-15,巨火视频,481,4,1803583
仅有14%的科室主任副主任年收入超过20万元,社会,2023-08-15,凤凰网,431,1,2365733
青你2杜紫怡曝tangoz性骚扰,明星,2023-08-15,娱乐有饭,267,1,10390393
tangoz报警,明星-内地,2023-08-15,新浪大文娱,116,4,2084469
儿子一把抱起出差回来的老爸转圈圈,社会,2023-08-15,新华网,285,7,1236794
张艺兴是国家话剧院演员,明星,2023-08-15,娱乐有饭,375,1,1349124
妈妈将自己和龙凤胎用水枪印墙上,社会,2023-08-15,农民频道,228,2,4388577
山东2元炒菜摊主回应走红,社会,2023-08-15,大众网,144,5,1613747
盘点一下喜提降级的野生动物,其他,2023-08-15,CCTV4,18,3,1234747
人类全程护送藏羚羊回家画面太暖了,社会,2023-08-15,央视新闻,244,3,2257270
李玟患乳腺癌仍坚持录完好声音,明星,2023-08-15,新浪娱乐,333,1,1486095
大脑为什么删除2岁前的记忆,社会,2023-08-15,新浪新闻,531,1,3206252
播一部火一部的明星,明星-内地,2023-08-15,爱豆星闻在线,262,4,1157569
四六级,教育,2023-08-15,中国教育报,485,1,1700349
易烊千玺去看薛之谦演唱会,明星-内地,2023-08-15,芒果星剧场,359,4,1179891
为什么高铁座位没有E,社会,2023-08-15,人民日报,369,5,1238466
景甜冯绍峰藏头诗互动,电视剧-国产剧,2023-08-15,四四十六文娱,263,4,1333099
为什么全身脸部的皮肤最差,搞笑,2023-08-15,图一乐呵,391,4,1231647
常州分尸案嫌疑人已落网,社会,2023-08-15,手机上的新浪,147,2,1107978
取已故丈夫190万银行存款遭拒,社会,2023-08-15,每日经济新闻,316,4,2180978
8K镜头带你看遍大美中国,社会,2023-08-15,人民日报,331,3,2429816
张子枫志愿军吃土豆镜头,电影,2023-08-15,FashionWink,192,5,1130149
中国总和生育率已跌至1.09,社会,2023-08-15,每日经济新闻,100,2,3203630
国家统计局强调当前中国经济不存在通缩,社会,2023-08-15,头条新闻,201,4,1412691
目前大部分毕业生已经落实就业去向,社会,2023-08-15,每日经济新闻,204,4,1402856
涂山璟既要又要,电视剧,2023-08-15,草地视频,162,5,1158026
以为是休息实际在耗气血的行为,搞笑,2023-08-15,知名青年小新,384,2,1932358
Doinb下跪道歉,游戏,2023-08-15,兔玩电竞,189,4,1577347
青年人城镇调查失业率将暂停发布,社会,2023-08-15,凤凰网,172,5,1384520
男子接完诈骗电话卡里多出14万,社会,2023-08-15,江苏新闻,188,4,1017320
伊甸园字幕组解散,明星,2023-08-15,新媒喧娱,123,3,1412882
一个人如果突然关了微信运动,搞笑,2023-08-15,图一乐呵,262,1,1618587
子弟兵在抗洪一线,军事,2023-08-15,央视军事,564,3,1604151
这里是中国的国家公园,社会,2023-08-15,人民网,6,3,1374424
3人偷渡到缅甸搞诈骗却因文化低被拒收,社会,2023-08-15,中国新闻网,529,1,1682343
我国再次成功发射一箭五星,社会,2023-08-15,央视新闻,90,3,1233612
48岁大姐成功应聘月薪3万麻将主播,社会,2023-08-14,点时新闻,270,2,1017240
刘涛一次性发了36张图,综艺,2023-08-14,新浪综艺,407,1,2631551
癌症在我国已经熬成慢性病,社会,2023-08-14,白鹿视频,418,1,2021942
港媒曝周润发不听医嘱继续跑步,明星,2023-08-14,新浪大文娱,255,4,1290032
涂山璟你否认啊,电视剧-国产剧,2023-08-14,看文娱,118,4,1261479
檀健次从倒数第一到全国第一,电视剧-国产剧,2023-08-14,宇宙文娱派,348,1,2718695
他现在甚至都懒得张口了,搞笑,2023-08-14,小刚在大理,229,2,1506050
张晚意邓为你们不要再吵了,电视剧-国产剧,2023-08-14,桔星文艺,164,6,1045490
小沈阳晒女儿与薛之谦合照,电视剧,2023-08-14,梦清娱乐,246,2,1125328
子弟兵高温下抢通道路清除淤泥,军事,2023-08-14,央视军事,246,3,2053938
爷爷授课18年不收费说有退休工资,社会,2023-08-14,大米Video,154,2,1880336
消防员救了个奶声奶气的卡手娃,公益,2023-08-14,中国消防,149,5,1544590
男子球场晕倒4名打球医生合力抢救,社会,2023-08-14,西部决策,142,2,2204014
冯绍峰的女主运,电视剧,2023-08-14,来看弹幕,230,1,1285823
EXO来见中国爱丽了,明星-日韩,2023-08-14,爱豆上班啦,418,4,1120753
有医院院长收受100套房,社会,2023-08-14,头条新闻,438,1,2176347
什么是开水房,电影,2023-08-14,牛马文化研究员,254,1,1535375
每个博物馆都有一个显眼包,社会,2023-08-14,人民网,303,3,1636290
加拿大山火已烧了几个月,社会,2023-08-14,央视新闻,517,2,1728921
终于有晚会请孟子义唱歌了,明星-内地,2023-08-14,剧星文艺,123,2,1187727
洪水后战士们一家一家问能帮忙干什么,社会,2023-08-14,央视新闻,65,3,1587886
仅4%受访年轻人几乎不熬夜,互联网,2023-08-14,麦穗财经,299,1,2106319
你希望调休取消吗,社会,2023-08-14,中新经纬,199,2,1459540
张碧晨也去看了张艺兴演唱会,明星,2023-08-14,网上冲浪快乐指南,262,3,1551465
为什么电影院的最佳位置没人选,搞笑,2023-08-14,搞笑女的快乐日记,249,4,1335119
下颌线与下颚线的区别,科普,2023-08-14,野生脑洞,232,6,1003727
魏大勋耳骨夹,明星,2023-08-14,沸娱,177,2,1531703
魏大勋杂志秒没,明星-内地,2023-08-14,追新视频,122,6,1229471
前任4定档,电影-华语电影,2023-08-14,新浪电影,132,1,1918940
医生称极少贪腐代表不了辛苦的群体,社会,2023-08-14,第一财经日报,186,1,1619186
巧妙散热让博物馆的热度细水长流,社会,2023-08-14,央视新闻,727,3,1740497
为什么商场的一楼没有卫生间,情感,2023-08-14,孤岛少年,279,2,1147031
熬夜熬的是甲状腺寿命,社会,2023-08-14,新浪新闻,713,1,2057544
孤注一掷票房断层第一,电影,2023-08-14,有娱追剧,670,1,1846332
沈腾问范丞丞的脸是靠打针吗,综艺-内地综艺,2023-08-13,芒果捞智多星,218,2,1244949
男子要女孩微信被拒后对其爸爸动手视频警情通报,社会,2023-08-13,新华社,389,1,1952614
江苏盐城龙卷风2死15伤,社会,2023-08-13,央视新闻,103,4,1275283
三里屯太古里回应北区女生被偷拍,社会,2023-08-13,西部决策,169,2,1804376
云南地震,社会,2023-08-13,人民日报,171,1,2550214
杨紫羊了个羊通关后的反应,电视剧,2023-08-13,浪里看新剧,331,1,2218230
BLACKPINK疑似又有人划水,明星,2023-08-13,青栀如花,33,4,1172375
05后就要开学报到了,社会,2023-08-13,人民日报,119,3,1575315
西安泥石流已发现21名遇难者,社会,2023-08-13,北京青年报,279,5,1468665
内娱Queencard决赛圈,明星,2023-08-13,多侃心话,241,6,1161659
洪水过后小学的黑板报看到泪目,社会,2023-08-13,央视新闻,122,3,1924509
体制内离职的人现在怎么样了,搞笑,2023-08-13,领导我是小明,376,1,2266399
玱玹和涂山篌联合杀了璟,电视剧,2023-08-13,娱小鸭,340,2,1147859
网友高铁站偶遇王冰冰,综艺-内地综艺,2023-08-13,白鸽视频,150,2,1011471
武警清淤后双手发白让人心疼,社会,2023-08-13,新华社,181,3,1549623
江浙沪独生女真的值得羡慕吗,社会,2023-08-13,新浪新闻,411,2,2069117
身体缺啥脸上就长啥,搞笑,2023-08-13,牵念,404,1,2498938
被流放27年的泰国王子突然回国,搞笑,2023-08-13,知名青年小新,335,2,1491173
暑期防溺水安全指南,社会,2023-08-13,央视新闻,10,3,1204413
退伍老兵敬礼送别抗洪官兵,社会,2023-08-13,央视网,693,3,1435898
黄子韬怎么一直惹徐艺洋生气,搞笑,2023-08-12,头脑机灵,241,2,1234211
25岁86个好友什么水平,搞笑,2023-08-12,图一乐呵,196,4,1122829
邓为被说撞脸六小龄童,明星,2023-08-12,追星养成手册,87,5,1099326
杨紫这次选择了相柳,综艺,2023-08-12,剧综种草机,184,1,2424765
一对双胞胎展示同款举手睡姿,社会,2023-08-12,人民视频,287,5,1216214
唐悠悠你现在真的成黑老大的女人了,电影,2023-08-12,浪里看新剧,152,6,1231822
去西藏玩不要戴空顶遮阳帽,搞笑,2023-08-12,牵念,240,2,1814247
国家一级演员苏孝林被立案调查,时事,2023-08-12,极目新闻,144,2,1799190
长相思男主爆红后综艺首秀,综艺,2023-08-12,影讯周刊,166,1,2219708
琵琶与古诗词邂逅有多浪漫,社会,2023-08-12,央视新闻,178,3,1849090
白日梦我原著党两眼一黑,电视剧-国产剧,2023-08-12,月见文艺,280,1,1238854
阮经天出车祸,明星,2023-08-12,会火全娱乐,325,4,1477036
孟美岐挑战安崎输了,综艺-内地综艺,2023-08-12,中国网娱乐,261,1,1518395
缅甸旅游业苦等中国游客重返,社会,2023-08-12,新浪新闻,448,1,2203483
鹿晗张艺兴刘雨昕演唱会人气,明星-内地,2023-08-12,会火星剧,32,8,1057794
59岁法医因抑郁症女孩一句话哭了,社会,2023-08-12,大米Video,259,1,1564562
这个芭蕾女孩居然是沈梦辰,明星,2023-08-12,就想追星,154,1,1206384
减灾避险实用安全指南,社会,2023-08-12,人民日报,27,3,1170809
女孩险被诱骗到缅甸在加油站获救,社会,2023-08-12,新华网,234,2,1443304
致敬青春最美的样子,社会,2023-08-12,人民网,244,3,1486253
全家22人从云南送小伙到国防科大报到,社会,2023-08-12,星视频,246,2,1501157
网友评程潇喂许光汉吃东西像扔厨余垃圾,明星,2023-08-12,迷妹剧综,212,5,1383085
电动车室内充电爆炸到燃烧仅3分钟,公益,2023-08-12,中国消防,70,7,1244115
刘天池爆料质子团选拔,电影,2023-08-12,1905电影网官博,211,1,1407146
肾好不好睡一觉就知道了,搞笑,2023-08-12,知名青年小新,648,1,1623144
娜扎经纪人为接广告道歉,明星,2023-08-12,芒果星剧场,266,4,1180993
妻子实名举报医生老公每年药品回扣十几万,社会,2023-08-12,凤凰网视频,575,1,2259531
医生说曾黎顶多30岁,综艺-内地综艺,2023-08-12,拯救剧荒计划_,489,4,1420792
从七只到九千多只中国朱鹮保护成为世界范例,社会,2023-08-12,CCTV4,112,3,1167704
李雪琴的北大真是没白上,明星,2023-08-12,剧视大好,428,4,1066580
宿舍用了9000度电是什么体验,搞笑,2023-08-12,野生脑洞,317,1,1717669
人气旺起来消费火起来经济活起来,社会,2023-08-12,央视新闻,239,3,1492297
我好像删到电脑的大动脉了,搞笑,2023-08-12,知名青年小新,449,1,1202436
刘浩存把丁程鑫撩到耳朵都红了,明星,2023-08-12,追剧颜究生,241,1,1899541
那英 你不吹牛能死吗,综艺-内地综艺,2023-08-12,小新文娱,387,4,1249225
洪水来临时哪些地方是危险地带,社会,2023-08-12,央视网,674,3,1301279
程潇妈妈得了乳腺癌,综艺-内地综艺,2023-08-12,资深综艺鹅,639,4,1194964
长相思发了小夭梅林分轨文件,电视剧,2023-08-12,星仔超人,592,1,1195997
吴倩选择武大是因为离家近,综艺,2023-08-12,新浪综艺,558,1,1361294
央视网文娱评长月烬明,电视剧,2023-08-12,央视网文娱,499,1,1007505
长相思梅林统一了剧粉,电视剧,2023-08-11,剧综教导员,139,4,1326849
医药代表性贿赂医生,社会,2023-08-11,中国新闻周刊,583,2,1812474
SHE时隔四年再合体,明星-港台,2023-08-11,会火全娱乐,196,1,2478139
大爷高铁上戴耳机喝白酒全程安静,社会,2023-08-11,后浪视频,270,2,1022335
女工程师为出轨对象成为间谍17年,社会,2023-08-11,小央视频,576,1,2875188
再紧急预拨14.6亿元支持京津冀黑吉救灾,社会,2023-08-11,央视新闻,139,3,1624317
高叶狂飙后首部电视剧,电视剧,2023-08-11,有点娱,301,1,2125761
王鹤棣终于演了西装暴徒,电影,2023-08-11,最美表演,335,2,1561165
杨紫从来不用假发套,电视剧,2023-08-11,剧荒主义,278,2,1623540
赵丽颖到底在过哪个季节,明星,2023-08-11,前方剧透,306,4,1500917
中国已成为全球生育率最低的国家之一,社会,2023-08-11,每日经济新闻,106,2,1178529
大戏看北京,综艺,2023-08-11,北京卫视大戏看北京,101,3,1586400
雷军建议大家少刷手机,时事,2023-08-11,环球时报,341,1,2062789
长沙一小区给业主发60万元现金,社会,2023-08-11,西部决策,127,2,1421944
全国文化中心建设十件大事喊你来投票,社会,2023-08-11,北京日报,48,3,1694378
Faker遭到谋杀通知,游戏,2023-08-11,三分有娱乐,411,2,1590285
白日梦我,电视剧,2023-08-11,白马时光文化,265,2,1124489
张晚意给毛不易交作业,音乐,2023-08-11,娱乐宇宙派,156,6,1307395
北京地铁开通时光列车穿越6个年代,社会,2023-08-11,西部决策,36,5,1253829
分秒必争空降输电铁塔超硬核,社会,2023-08-11,央视新闻,217,3,1812772
杭州女生获奖百万哭着感谢张大大,社会,2023-08-11,晨曦视频,163,4,1510529
98后白衣天使跪地20多分钟抢救昏迷老人,社会,2023-08-11,新华网,51,7,1340806
120斤重的00后战士背了70斤物资,军事,2023-08-11,央视军事,185,5,1458566
周冬雨刘昊然浴室戏,电影-华语电影,2023-08-11,剧娱指南,358,4,1713543
唐嫣首部仙侠剧女主,电视剧-国产剧,2023-08-11,破晓视频,377,1,1716131
向佐郭碧婷新电影,电影-华语电影,2023-08-11,看新剧,172,6,1071587
电影花千骨陈都灵赖美云演母女,电影-华语电影,2023-08-11,新浪电影,308,1,1485587
这届大学生是懂暑假的,社会,2023-08-11,人民日报,6,3,1197779
我在国门一线,社会,2023-08-11,中国网,93,3,1864135
女孩考611分暑假为全村孩子讲功课,社会,2023-08-11,大米Video,281,2,1277765
张晚意梅林戏份被删改,电视剧-国产剧,2023-08-11,桔星文艺,296,2,1287287
国安机关破获美国中央情报局间谍案,社会,2023-08-11,人民日报,402,1,2817123
亚运福利100多个景区公园免门票,社会,2023-08-11,人民日报,777,3,1564093
河北暴雨洪水死亡29人,社会,2023-08-11,央视新闻,244,1,1957896
下班后微信办公算加班吗,社会,2023-08-11,新浪热点,325,1,1744022
念无双官宣,电视剧,2023-08-11,念无双官微,131,1,1800222
吴倩离婚后真是人间清醒,明星-内地,2023-08-11,看脸科普君,703,5,1001853
警方通报280斤店员被打拒不还手,社会,2023-08-11,沸点视频,215,2,1188616
在新疆连玩10天有多爽,美食,2023-08-11,豹纹儿er,569,1,1099154
改一下涂山璟的台词吧,电视剧,2023-08-11,追剧综的李二狗,528,2,1026444
14岁华裔炫富网红LilTay离世,社会,2023-08-11,九派新闻,68,1,2318008
紧急下达15.05亿元水利救灾资金,社会,2023-08-11,央视新闻,86,3,1006237
